id,title,abstract,year,field,author,inCitation,outCitation,journalName,journalVolume,journalPages
e2b35c55ec9c40b628b2d4bd82dd908d4a5916f4,"Multiple Testing and False Discovery Rate Control: Theory, Methods and Algorithms","Author(s): Chen, Shiyun | Advisor(s): Arias-Castro, Ery | Abstract: Multiple testing, a situation where multiple hypothesis tests are performed simultaneously, is a core research topic in statistics that arises in almost every scientific field. When more hypotheses are tested, more errors are bound to occur. Controlling the false discovery rate (FDR) [BH95], which is the expected proportion of falsely rejected null hypotheses among all rejections, is an important challenge for making meaningful inferences. Throughout the dissertation, we analyze the asymptotic performance of several FDR-controlling procedures under different multiple testing settings. In Chapter 1, we study the famous Benjamini-Hochberg (BH) method [BH95] which often serves as benchmark among FDR-controlling procedures, and show that it is asymptotic optimal in a stylized setting. We then prove that a distribution-free FDR control method of Barber and Cand`es [FBC15], which only requires the (unknown) null distribution to be symmetric, can achieve the same asymptotic performance as the BH method, thus is also optimal. Chapter 2 proposes an interval-type procedure which identifies the longest interval with the estimated FDR under a given level and rejects the corresponding hypotheses with P-values lying inside the interval. Unlike the threshold approaches, this procedure scans over all intervals with the left point not necessary being zero. We show that this scan procedure provides strong control of the asymptotic false discovery rate. In addition, we investigate its asymptotic false non-discovery rate (FNR), deriving conditions under which it outperforms the BH procedure. In Chapter 3, we consider an online multiple testing problem where the hypotheses arrive sequentially in a stream, and investigate two procedures proposed by Javanmard and Montanari [JM15] which control FDR in an online manner. We quantify their asymptotic performance in the same location models as in Chapter 1 and compare their power with the (static) BH method. In Chapter 4, we propose a new class of powerful online testing procedures which incorporates the available contextual information, and prove that any rule in this class controls the online FDR under some standard assumptions. We also derive a practical algorithm that can make more empirical discoveries in an online fashion, compared to the state-of-the-art procedures.",2019,Computer Science,"list(name = ""Shiyun Chen"", ids = ""3391923"")",,,,,
fae226d423c9b02ee76dada34ebd4378d8d4cdd3,False Discovery Rate Control with Concave Penalties Using Stability Selection,"False discovery rate (FDR) control is highly desirable in several high-dimensional estimation problems. While solving such problems, it is observed that traditional approaches such as the Lasso select a high number of false positives, which increase with higher noise and correlation levels in the dataset. Stability selection is a procedure which uses randomization with the Lasso to reduce the number of false positives. It is known that concave regularizers such as the minimax concave penalty (MCP) have a higher resistance to false positives than the Lasso in the presence of such noise and correlation. The benefits with respect to false positive control for developing an approach integrating stability selection with concave regularizers has not been studied in the literature so far. This motivates us to develop a novel upper bound on false discovery rate control obtained through this stability selection with minimax concave penalty approach.",2018,Computer Science,"list(name = ""Bhanukiran Vinzamuri"", ids = ""3236313""); list(name = ""Kush R. Varshney"", ids = ""1712865"")",,3edae395b2a2e8a5a1796367cb7d1b0b206079d0; 112e2d4f6ffbfba004576a159ffdf60f5dad8d3a; 3394fcbdf258d8853ec6b8e539a75315c8d024b2; 7fda3b7e173936bc8acbafc7f2963c10675939d8; 58db9852fedd50a4732e3c174383710422c32ecc; 73a8a205a37f0169e89d3f0819a8ec36b39d3d2a; db7a68249fb6545a4f506f719c91083cec1db9b0; 3292ac13e0a06449a25a74ec103e213dcb2d8670; c59c6afcfd5d03eb2c8fb5d1665afacc077771b9; 7c316f6630e52fe5bfc027ea1795339035f6ab3f; ad3c82ada3ff848bb36bade1d90820c2e465b2d7; 97794d424f5e7cc555f6aeb187ab0849976dbeac; 7558afb2e73f0d737c2fa2b4c313a9170559ab7e,2018 IEEE Data Science Workshop (DSW),,76-80
48033ca1ded04c316079ed42bba3a18ca5e9c522,Gene expression profiles of peripheral blood leukocytes after endotoxin challenge in humans.,"To define gene expression profiles that occur during the initial activation of human innate immunity, we administered intravenous endotoxin (n = 8) or saline (n = 4) to healthy subjects and hybridized RNA from blood mononuclear cells (0, 0.5, 6, 24, 168 h) or whole blood (0, 3, 6, 24, 168 h) to oligonucleotide probe arrays. The greatest change in mononuclear cell gene expression occurred at 6 h (439 induced and 428 repressed genes, 1% false discovery rate, and 50% fold change) including increased expression of genes associated with pathogen recognition molecules and signaling cascades linked to receptors associated with cell mobility and activation. Induced defense response genes included cytokines, chemokines, and their respective receptors, acute-phase transcription factors, proteases, arachidonate metabolites, and oxidases. Repressed defense response genes included those associated with co-stimulatory molecules, T and cytotoxic lymphocytes, natural killer (NK) cells, and protein synthesis. Gene expression profiles of whole blood had similar biological themes. Over 100 genes not typically associated with acute inflammation were differentially regulated after endotoxin. By 24 h, gene expression had returned to baseline values. Thus the inflammatory response of circulating leukocytes to endotoxin in humans is characterized by a rapid amplification and subsidence of gene expression. These results indicate that a single intravascular exposure to endotoxin produces a large but temporally short perturbation of the blood transcriptome.",2006,Biology; Medicine,"list(name = ""Shefali Talwar"", ids = ""46339921""); list(name = ""Peter J. Munson"", ids = ""2283598""); list(name = ""Jennifer Joanna Barb"", ids = ""4925138""); list(name = ""Carmen Fiuza"", ids = ""5343232""); list(name = ""Anadel Pilar Cintron"", ids = ""14142320""); list(name = ""Carolea Logun"", ids = ""6439375""); list(name = ""Margaret Tropea"", ids = ""33298123""); list(name = ""Sameena Khan"", ids = ""48394798""); list(name = ""Debra Reda"", ids = ""37046071""); list(name = ""James H. Shelhamer"", ids = ""6263670""); list(name = ""Robert L Danner"", ids = ""4006329""); list(name = ""Anthony F. Suffredini"", ids = ""1697497"")",525575f344910290b84bde25c05b5d8ec1ce03ff; d61edf5a0bc1136c82705a0ec9ad6d3f991b702c; fb46798ef2bb403b782ba2ea0360d733ee156771; d1a4f5748620716f5988b9972b7735cb20152e4f; dbc0240818dd98472c8300f7c946f6041d34079a; e5849b36f4c1a8b3afdbd63f08db2b4af76f9e3c; 52909393c529bc2a5639d225052dd77c8095463a; 976176efb9891bad0c3e3a97adae216cce7d7e4d; 96f008f9cb6b5dc5b32133b5814628d618d65d6f; 3f1ac4bd4e6269be23529199a7d1ee9b7f57cacc; 60a302bc3499862614a24c3a9720c38349603143; 5988c7c4425d9b11cde27144bccc68a57000cd09; cb871cfec1953f912ce43d8326d9194fcf1bc5bd; c218f87ed0fc360facc13be8bd172fe735ef3823; 937f3190f127b9a7c0f13f67a81c197793942f7a; fb8c7cd2f781db68a10076b093c0d06da05923d4; e8e53dcc168272e0069d031e8b9deef4e5dbf64c; 889c209010ed62ad4be08c56757f29d29a91f1a9; 2e17a65185c0822af6d1b2a81527f6e2906609aa; d4176b3b8d5f36e36a46360593070f05116f172c; 0a9c5071503a2695e22a521a14f30543213b9ed8; 6aeca98063c2e8c71f3cf260ffd185749559d2d9; b954dc4d0ba55d8b83ac1b5c8d82e453f759078f; b0757245f3190e67bc52e2773fdf0e67e22c3087; 65912a16b3442c9d11e4451d44f7807de14a7f6b; 202aa86c3c50c03ef003bf14c9ef8b9055b4b79e; a9db85dfecab6ef82ebcea031ae7d78908014c75; 264e10de0bbd71996594e8933b4e399735e4d779; 5a63005e81962b8212c9ee667e5123e4e809c103; 68f96237f837d9bafaa5ce4d0f0638e4d820ccd3; 3f26e4fbc3b936e7625e19e0e7b52b0004ba684b; 6929057388bd6989a08fe7f9dd05cee10c7dcd52; fec25b5438ce17811fc27541e0aaf0630d38a2d8; 090ec005f5bbfc4a89724974e91659c281fe1f80; a6f2b600431192bfc7a0a4a1f494abff62a499d2; 5936590fca4790fefe47b4a165af564a607eeb82; d7e20f4a9cef47dcde7a3e55fe09da98a5d368d9; 7490b8d591b38afd9351995495ab051f2c5e3064; a2b41db44518a996a48bc5c88724d7c6d84601cf; 4d2debccf1c5f7f0a606576a32fa11c0fbe22888; d4b3ab52033d6cf2b7f82f83507aa24693032d96; be68f7632eb4b2809ba12f50bc5b045e978f1c56; df162c9999b99bec5e84a5416965c0e37d28d898; 096d732f661ca717ec0403e73403795e63ef132c; 8b407f4a201f46affc21c7c10633c11c807c7d5e; 82d3bedf8fb97b5b4f390997c5cfb80d421e021b; 4bf435030be7929873a0a3727d8c703af4162b04; c3ed063455e4feab6fa45dd31a9f0d88c2d8272d; 7d1ccddd9f67c75acc9cdacdb35f6627a213b316; 5494436f830df24dfa4e0d3288805af16ebbb26c; 05676504e262372b03945d49bde275e91d433b87; 509f99a14ff07434bc6d55809046abfa372b9840; bada32c9171213762509a12a71bb1f74a35d1d71; 6ac43e4c22c5143e8c7ff5b3a2548089ef1e9d85; cc4be9f70beb8bf80ca98c4ac2979fb28abf3e18; 03d1252aff4070b15d314126590827b63edea856; 7135fedaf3d1c11163806460b4c322df95e321e1; 4ed73b5c10947318343a033745f3785d5b2e8cef; 152a616148a41c162327eed160c65229571ac909; b74b4ed20bf22fb25ca040f535e41012531b82de; 0652e21b448f1f5bb9ee0ab40235dbf2416d49b2; edeb6813504ee01fad419c457003058365becb31,187305a527baa300127427b1226350dc522557d0; 120a0613b4343f2f3d89d72958b531a5a86559e2; d9b4ea74de6b6de9b354731b5bc122a9ea63232e; 8c7f94c86c8913e5bcd1ea314c3140728fc98974; 38ee3d60f2b8a8d97cec779a356e34ffa9b3b29d; b8d9738c1b77f0aab59dded4b2be47a768bf23e0; 23bc8f821daf867385989b0129d12e4a552c5a0e; 29e895e021d7ba5a093046698656d3d5e9a66833; 9ea971aa9d3430a25cf0859360e011aeb6a43176; c2d9a8d2f27f7f8c8a4efaa0afafad16acf30326; ad214ff343d3a9b62291eb7fefc2628cf9ac678e; ac02c0b10469ba828b235c5887dc44a90b16f31a; 2f1b50024a0e0510015116a46b4a46ac3c8afb0b; f7fb19222e22c62fbe4462ffafaf52bfad1aefd4; 73bb5d2c2884053bff75af7bddb5bdd7955dcfb1; f05f22f6ce026bcdd877085d55775a429c7025d5; 75a1fa84032de09eca33c80e4c8399814f9aaad1; f3e4c2304330b55d18b63e7649afd26910107ebc; 61985157bd963fb335138ab5d5afda747194d8f6; 2a721fd343aacd72c5b6994b3f380a7979481360; c2142f594db022c38ed78fa674e19d57ec9aa658; bdd24c43108fe711cf905c2c07ff6f3be0b6ac56; 531fa5d4ed7315364ed31e5362c50709797c9498; b2d7031ee992475037f7a396b0fad1b80b5cbd67; dd2105b179beca02ce4e24209b69cb74b37f10f9; 154b2029f56e608cbe24e6b0547fb15e284ddd41; b7c303e1c0c451bb0e295bcef6ae95eda1d1306b; 04ebbbce81a03edbd725dd16e7c814f491413957; 48f7d95d56b456f92b0e394e87b83d5c3705ef38; 3c3de7992dd2d0b771dfe6b485ecfafc8c84af0a; 16134c55b933432d8f4ee923f0b2fd6409e0f45f; 091cb89604b4570fd25d4cd62fb5422013c7619b; d604b7396841e19487829507c564f76345a3d727; 5e6a49a21e79ad8d755ffc9eb4cf32f431f95183; 130709f64a0d1762af9da63cb97975fca198311b; 2e2989ba75d3e56f9931e94beb3d0aced0ebc2e2; 05a4590acdc94e2cdce75c5d3cc3d0308f786f06; 8de4306389c0ea5eb41245aec159ee29217f5406; 7789f3d531d44c806583afacda5d0d59a5ec5cba; 3d498266636a56fba6459148ec0c30e683ebec62; 6f5847a06d5f0b70138a82dce411ed1de30ee2d3; 11338486b0e8c3cee476ff5f38ba07a21a5b47b4; 4831e17190664f6868342a96e9f7b1fcf04a8fc1; 5a3b7c27abfdda9f0e2767c895d51873f8023c44; 2049840cae4bac85ae38869901a1c8c5d22c6a28; 1fa776a4153bd2d2bdcddcf2eb0ddcd4dc75f412; e5b7966f47a13cece7833aa3b775f9531d1323e6; c870a278991fc3e31da0a17d09a60e5b1c4485be,Physiological genomics,25 2,"
          203-15
        "
395736e43dec0d6e9927ff4c104d1bb19ef0841f,FUNC: a package for detecting significant associations between gene sets and ontological annotations,"BackgroundGenome-wide expression, sequence and association studies typically yield large sets of gene candidates, which must then be further analysed and interpreted. Information about these genes is increasingly being captured and organized in ontologies, such as the Gene Ontology. Relationships between the gene sets identified by experimental methods and biological knowledge can be made explicit and used in the interpretation of results. However, it is often difficult to assess the statistical significance of such analyses since many inter-dependent categories are tested simultaneously.ResultsWe developed the program package FUNC that includes and expands on currently available methods to identify significant associations between gene sets and ontological annotations. Implemented are several tests in particular well suited for genome wide sequence comparisons, estimates of the family-wise error rate, the false discovery rate, a sensitive estimator of the global significance of the results and an algorithm to reduce the complexity of the results.ConclusionFUNC is a versatile and useful tool for the analysis of genome-wide data. It is freely available under the GPL license and also accessible via a web service.",2006,Computer Science; Medicine,"list(name = ""Kay PrÃ¼fer"", ids = ""3093288""); list(name = ""Bjoern Muetzel"", ids = ""1883390""); list(name = ""Hong Hai Do"", ids = ""36851470""); list(name = ""Gunter Weiss"", ids = ""48773515""); list(name = ""Philipp Khaitovich"", ids = ""2388476""); list(name = ""Erhard Rahm"", ids = ""1747414""); list(name = ""Svante PÃ¤Ã¤bo"", ids = ""2861780""); list(name = ""Michael Lachmann"", ids = ""2506835""); list(name = ""Wolfgang Enard"", ids = ""2089138"")",8dbc104a70eb8e954cb9c0b9b6297fb98ebc346d; f740234c54d411f3621402543701e497b20bc479; 50eb93aa454230bf0dbe5212d6fc37daea5c12c7; 7147d349dc7d7e911f084318d10e5f4c107106ea; 1d175c60844f148e4fc444694511a90cafb58de3; 1b43a3ce87adfc907637dd9ecb3ef15ce9346fc9; b8047ac531562873f9eea6166058e1e2ade426d3; 971058d69eeea5d561465a31690ac3f562ffefa9; 1baf7ba65c7e21f844e0bc6010098b7b12387555; bd1058c502a70b2523eee7834fd512ec6357b1b3; 0c8eadd7cfa3317f62cad8795e9d1b2ac2fb7fd3; 0e807411652ca9dba4486fc1e71c9b7f95a0c035; 2a3041d7c87f1841f0aeefe430c3306e02092100; 5c0bdb6a151a651bbcf3782224bd75bc5bd670a6; e327f1d818d2cc5068c7ec30705ea1294be51b60; 1eee97ef60291198df7db36665c3763a2648f9e2; 331b9f2a6348ecfb4615a82eaee282ac23d559cf; d3605703cf278bb786c9b9a1496e089eb852e83d; 37097ea2cb241e4074f967c9ba3aec627cfda303; 9a39e9957dd35b875b897a4ca6c80cd9f2f3e77c; a8a2ae6d12300e37f5bfa9acfd716b4fd0c3725b; fff5500b5f7e74fe718388adc0295b60dd7be687; d59b4b2d85e0886dab42564c44460da43440c254; 617a9853742132a90c6f4a624c80533b8e135788; aac38d3bb0e16db563243548de08173f8a298a40; 45ab3e2f24ccb689cbaa8d82c3c55806c8dcba46; a513dbdb99877b8ceb345f540a309d0433730bab; ab1a349c09eac3e0a9315708ff95e6553cbba4d9; d2f8a310180250010c4c29be7163aba7364ae73c; 4ffd5d5ce8fadc875b7002a472b30f5c23ddce8e; 49bb4c97dd7df081d6aeea76eb3a037a0beebf3a; 1b45fab93626eeabb2fdbba33059257e12144350; fe8dc3c125d024087bc6355b05686cabbc979987; c5a6449877f9f8260bc1ceb11a10793f56fcdbd1; b8215aebd751297028ac74a365b6cdddd8e8e647; eee526180dbc70415e55f9e727cb171bdec43253; 051e6eaafd0346c8293c68a358c8d5c0ffcf4813; d789f7725654a7630adfe7e2650cca57e96bb3eb; 81e56aa9bf599bdef8c27c33bf06152b88d8b7d9; c28205a284cfa6b370873f6d50a258813aa2ad0e; 69aa068e0e54a3eab7c960ff04a1b3ea97900a8a; 8ae6d3da7d5730900fdc6c2b0a9c13c098b5dbed; 2cac17d4ac07d144d5766226702de8dd64202c3b; 1b38684b8cd163ad1e2eadf75376674167230378; 6042cba63b8090134346a0aa2b6a1a8c7ad91116; 808b73b69201bcef494d5b3fadfbefb72ad44a76; 2b9ac3795f7dbbc3a071a26cfea80b21ee15b455; 12c220fc52ff87898205b446dfb4e4078b6f82dd; 430bea7e8fb17bd9ff4ac6448ffc8d9661a95488; 5ea06065e066ae9bef8129437245eb233068adb3; 737e6e71ee2129696a8b31864f2d99fde514ae88; d21b2f9bdcf4d806505a7dfe3ab939a1261a86f7; f59602c4b5a5c76532293e84fb499f60509417bd; ef7ed3331681ce1f1adf8655bad383076c194061; bb2d815db5c2a33d440ee5f87283411070de414c; a96ee63ad2564baa72f89fc217cd43b3edd67b3c; 52eead831672fe320c04a7221377c79e634f3c69; f4d20166319a5b132df49493cba583a2a9fbc2a2; dad3ab5453f25731b50cb8b9212fad9755ce005f; 4983f9d66ac0aee575fb0156a3218e97a089e1ce; 3675e7b88dcb4e50c89068616a0d61d7adf51fa7; b4dbcb97a03aeced290c12f19e89421cb31a37bb; 406dd488adba343a30e4316d77e23e8701531fe1; e5d6f7512a9dfc981ee00b9802b6a1b1537e35ea; 23f33b721d05b4010193414feb519316bd01dc7d; c94235433952ede314492d1b554f6d07a4983e4d; 17a684a05184beccb970ee2bf8ce1239c37be80a; e7d1e5b97656c34cbabb28eb307ba5eda9b96cf3; d2c5f06b1c4bc2dca8581ffb44695a57b08af5de; 36ed1c1bc630e6c25738dab9a2324148bf6b5771; f319c131d0336525733cb64255d596e862ff3cfc; ab9ca3d06734cd23a5ee65b3fc6ad98f86d49b99; 940f1a12db45b0af596a3d4d153c16cda8be3ff6; 1d0e9a95f0c59c820fd7438e9ba5a130821bf92e; 81b3ad633962f5a40ca1d351f9d86c2b3187113b; 2130677306311f4dd2d412cac9baf9616fa40417; 6fc1f09d3f324837e696a0541cecbf216ba94088; c7fec55b8f7e8a9d57747491de4beb17874042dc; 804f929a12ecbd64aacc8ce8ba93b849c81ccb37; 3452f4ad7a6050bdac017e06f8121d4edd3e6f49; e7c85cafd86ce1b8ba8f54b63186dcb77c4c578f; 9e55f7a38467fcb0ab070cca4f7cbae175283dcd; 9da6e62668e0169a43f2d5b873f1fa1110e7bd0b; 172745125aac8ef07f5ad8abe00934f81a3e1c2a; 09f08d645a97f785e875bf0acfd39cc43a372157; c148182c6f64b7b8aa4924f9786a5b9423f395a1; 1bef331d42cb47ac67c81b55d5880c33cf90e7f5; 3156d5c827ccfea4a878d75cbde2b4e7ec344f2a; 6553b839f2582d3b983f2693809e813106677caf; 312381edfc8a5c12114eed638fb067d3fb6ef663; 00ce63094828b3a75f0adbac162ed9002bf5dc6d; 13ae71217f594bca06adc099619c80b06ff52e7a; e96ea2bb3836fa0e16c8b9fa54e9e26c1b13cb93; 763c38a2eb0c4eaa3f3e842268c2c12a11ed58f2; 0d63d26d9443ee13fe0242e631bb3ff194f8d49c; 567a564f0abe3f6a2537fb29fee55f165aa54404; 37b88cdbfdf50f9508d215b793775b2b0a06e0ee; ca0e57bfe3c12a134604565f469087a295aa1177; ccc6ec2d3162bf9a440f7802dc87f1b7c7910f40; 2409c5af1b45b24c209f42e5fc10b1eb1362fb90; 5a3c0a3709d736cbaa10fad27ee531ee3b2d127a; f3a375608460391f1f7cd14fa9f2df9113d9c778; c345fcb41780dd0304b13f5ab04e53b2cab2465a; ad8e17e24f43014fb0838f7454fa24af7e380a95; 5b2d2a196ae7e375b0dd9bf7dbb3ac9eb2cda64e; 80d65806189ceb3bc42f303dbda76c22f90b43fb; 4bf6d2c5370f66ab43ae4eaf5eaff3f1bb08abba; a9f3c29672b24885535d028e61a8e77e06ee66dd; ed39ee00e8c505a44803644997902dc5b4c3828f; 769f7a31ce4b168718ce9e5a014522e756e22e2a; a4e19750d018c196edac7eb69d6edb53716a2fbf; a4b488fa32dbb69d83588f05c03dd9725b2ddc05; 1b678a3ba5e45f212d9a0b0ea67d8e56cc0d44de; cfdd49f077754818ed438d98eeb74c7524e0a439; a4fe110146aa665ba38d8c70dc88b1214d81ba52; a9e22fa416a5f8cc2e91f210dd6cb5839b9028a5; 49ced305d37b3c949c0aba96ca1f2e4393dc7aa3; 0858bf6172cd80f87da2a5d05aff1d75030b34d3; c9d3d9412690c515c0d400f9ed4d35551553be5c; 1759d2d24dbc2c134f31b97218614161a6054ae1; 3469474c516ebca46a5e8a96abf95f25f7573eb1; 49a9e677728b0470ce827e118a881dcf7cb76ded,a411f6a0e6473137ac1a538f7cee65722fa3584f; 286715c491211b11fe030b74f098ba3b71ce094f; dba0c8257bd89cba911f0bb7bb593464d6595c5a; 156e7730b8ba8a08ec97eb6c2eaaf2124ed0ce6e; a71db54e9132712de22ca3fb43be39e7237c8867; 51dc0d53a772068f0928350c36bc16fad44e47ad; 0c2753df73bb3671bad8ef48763443d8f7a213ef; 7a27877026d41260203e80cb2ba9a2389cc98bb0; b79ff82502b35738c16b42a47b7f23334fab99c8; b5d067d7bab6d4a5ed44adcd51c994a1b729c9d3; a2792d78d7bd427008232a007741d3347fdc2072; 2b588b189dfc022f5bb4f3c4ac7cd28220a84a2c; 37f47ce11ad87b569cab4acf6316df5dac7b433a; 5e30bbc23c1edd28547692fb8033c8164149ca0d; 9c07c51fffda2a237fd9f7c4c0b2bb3f63f9b255; 130709f64a0d1762af9da63cb97975fca198311b; 251e40a3502ff24f7b1ccdba4d8e50f7b3472727; 188980ba192fdf08ad32eb26073c3d6e1c7a950d; abdf15d0094f90f4fb1379d918ef00d8101b1953; 31c5beeafccb48877530db023610e8604b1136ea; a89579758b9ed13d3ba62c3b501dd727b179db44; 6cd435383c457686d1425adf0412d95169d3d301; 43db684dc246d0f28a36b7cec3b84f1fe2cef0b4; fcef2258a963f3d3984a486185ddc4349c43aa35; 4683db85d02ea0a29d810f99add68ba67c081909; 256f29267c2317228f6a7b65d698326f0a285e36; f46b31b470931111d98191e39780062a207befc5; 3bb7a97fa9c31ca8fadc9b9d8fa68a2bd0c1553b; 281d91d96a1b36441118eff38fafdfcb178878a8; a2893118e14c29a23472b02249b4641b9971786b; 50bd6be85ce453aaf7fc419c42009beeb43426a8; 63b7ab168bf1426c146f654073c2bae73676e22e; 75ca252b6c7226f0ff978b3c695f200748fb0536; 6f06840ed8e83593a091ed56f5f19777609a3ff9; e46482b08d3e3f54b8c39ad1b1e18e969bcc6e09; 0f3023a056d5c201e9226a724f1e76d73fb22676,BMC Bioinformatics,8,41 - 41
2d46a9f4be9cd4b85f0e142837b350b1a5e20090,Abstract 14841: Whole-genome microRNA Sequencing Reveals Circulating microRNAs as High-Risk Markers in Non-ST-Elevation Acute Coronary Syndrome,"Introduction: MicroRNAs (miRs) have emerged as promising circulating biomarkers in cardiovascular disease (CVD). Given the complex relationship between clinical risk factors and non-ST-elevation acute coronary syndrome (NSTE-ACS) outcomes, understanding the relationship of miRs and high-risk factors may help dissect independent versus mediating effects of miRs on NSTE-ACS outcomes. Hypothesis: There are associations between specific circulating miRs and established clinical risk factors in patients with NSTE-ACS. Methods: Whole-genome miR sequencing was performed on total RNA extracted from whole blood of 199 patients with NSTE-ACS from the TRILOGY-ACS trial with similar baseline characteristics. Generalized linear models were used to test associations between 247 identified miRs and 13 high-risk factors CVD risk factors including atrial fibrillation (AF), Global Registry of Acute Coronary Events (GRACE) score on presentation and chronic heart failure (HF). A false discovery rate of 0.05 was used to correct for multiple comparisons. Results: Overall, 205 risk factor-miR associations were nominally significant (p Conclusions: We identified circulating miRs with expression patterns associated with high-risk factors in NSTE-ACS. MiRs 3135b, 126-5p, 142-5p, 144-5p and miR 28-3p are known mediators of CV development or disease, suggesting their potential role in modulating genomic risk in NSTE-ACS. These miRs may serve as prognostic biomarkers for risk stratification to better predict poor outcomes in patients with NSTE-ACS.",2016,Medicine,"list(name = ""Alice Wang"", ids = ""46991229""); list(name = ""Lydia Coulter-Kwee"", ids = ""1435071354""); list(name = ""Elizabeth A Grass"", ids = ""39198197""); list(name = ""Simon G. Gregory"", ids = ""1897273""); list(name = ""Paul Wayne Armstrong"", ids = ""2039723""); list(name = ""Keith A. A. Fox"", ids = ""152130696""); list(name = ""E. Magnus Ohman"", ids = ""6360747""); list(name = ""Matthew T. Roe"", ids = ""9750027""); list(name = ""Svati H. Shah"", ids = ""88504712""); list(name = ""Mark Y Chan"", ids = ""47079310"")",,,Circulation,134,
960141fd7d906a24ab06288863aef7714c9c5dcb,De novo sequencing of unique sequence tags for discovery of post-translational modifications of proteins.,"De novo sequencing is a spectrum analysis approach for mass spectrometry data to discover post-translational modifications in proteins; however, such an approach is still in its infancy and is still not widely applied to proteomic practices due to its limited reliability. In this work, we describe a de novo sequencing approach for the discovery of protein modifications based on identification of the proteome UStags (Shen, Y.; ToliÄ‡, N.; Hixson, K. K.; Purvine, S. O.; Pasa-ToliÄ‡, L.; Qian, W. J.; Adkins, J. N.; Moore, R. J.; Smith, R. D. Anal. Chem. 2008, 80, 1871-1882). The de novo information was obtained from Fourier-transform tandem mass spectrometry data for peptides and polypeptides from a yeast lysate, and the de novo sequences obtained were selected based on filter levels designed to provide a limited yet high quality subset of UStags. The DNA-predicted database protein sequences were then compared to the UStags, and the differences observed across or in the UStags (i.e., the UStags' prefix and suffix sequences and the UStags themselves) were used to infer possible sequence modifications. With this de novo-UStag approach, we uncovered some unexpected variances within several yeast protein sequences due to amino acid mutations and/or multiple modifications to the predicted protein sequences. To determine false discovery rates, two random (false) databases were independently used for sequence matching, and ~3% false discovery rates were estimated for the de novo-UStag approach. The factors affecting the reliability (e.g., existence of de novo sequencing noise residues and redundant sequences) and the sensitivity of the approach were investigated and described. The combined de novo-UStag approach complements the UStag method previously reported by enabling the discovery of new protein modifications.",2008,Medicine; Chemistry,"list(name = ""Yufeng Shen"", ids = ""37082667""); list(name = ""Nikola ToliÄ‡"", ids = ""2429166""); list(name = ""Kim K Hixson"", ids = ""5111455""); list(name = ""Samuel Owen Purvine"", ids = ""3036325""); list(name = ""Gordon A. Anderson"", ids = ""2557072""); list(name = ""Richard D Smith"", ids = ""145558544"")",7bf9dfd84b15a31c56248f9cfded3d74a676518b; b697bab13ea06996e21b86a6d01263cac6b11cf6; 532f9ddc2d9581d35841dd41d956f5c029597d52; fb623e12375bfe14f0d8e195ace3652d1d4e2359; ebbb82846c9080f18a61ccf5393a569c0d3afece; d8ba59a277608ea9e6811c559f70b9a823120917; e92544eac053f2349653d5fa0ea8efca82f7b28a; 6cc88259bd9e933e451ef59bcb1f1d0aef9c53e8; 6bb2c92b3c07d6164c463b141b2a9d0e40dbfe30; 4d9e905245009ab0e2991f55e577594b4eae9cce; 9f72a689284b974910074724b811157ade44e504; 31cec0293d706302869df0a2703e06a469237bc4; 03ce51d60641efb5d94b57af201c71d88922241f; 03300076c8aab51e8fb34520126e6b24abc80688; 64710ab09b8bcf8344966ccf1dab38e279aa454f; 98149c268d9abb165c50de399366c4956363fa4a; 9e4d8b0386bb4bd13a90fe433dddc2c208e0c740; 21ce2676e7b83342e70aa6ea980240ab009ff0d4; d36b385299cad54113834292c819e1b4839bfeb0; aaaa91e6dc896eb36cb23a21a40dca087a3ddb57; b501c8d6f82f8829fb5bfa39d15530554b5ade7a,,Analytical chemistry,80 20,"
          7742-54
        "
