id,title,abstract,year,field,author,inCitation,outCitation,journalName,journalVolume,journalPages
bcc6170827bcfdc816aa3c778631a0df4871a88a,Brain Diffusion and Perfusion Alternations in Chronic Obstructive Pulmonary Disease ( COPD ),"Introduction: Cognitive impairment which has been documented as one of the important extrapulmonary problems is common in patients with chronic obstructive pulmonary disease (COPD) (1). Despite of their potential importance, understanding of cognitive impairment in COPD remains incomplete. Also, there is no proper diagnostic tool for the early detection of neurologic decline in COPD patients. The correlation between the cognition function and cerebral perfusion function of COPD patients by using brain single-photon emission computed tomography (SPECT) demonstrated that regional perfusion can be altered in COPD patients (2, 3). Brain CBF imaging can be used to map perfusion reserve in brain. Diffusion tensor imaging (DTI) can be used to evaluate the microstructural change of white matter in vivo. The purpose of this study was to evaluate regional microstructural and perfusion changes in subjects with COPD, by comparing with cognitively normal (CN) elderly controls by using voxelbased morphometry (VBM) analyses of 3D T1WI, DTI indices, and CBF maps. Materials and Methods: The subjects were classified in three groups: moderate COPD groups, severe COPD groups and normal control. Six subjects with severe COPD (6 men, mean age, 69.80 years), 13 with moderate COPD (12 men, 1 women; mean age, 65.23 years), and 12 CN subjects (12 men, mean age, 63.92 years) were enrolled in this study. There was no significant difference of demographic characteristics among groups. All patients and controls underwent a standard neuropsychologic test. MR imaging was performed on a 3.0-T MR system (Achieva, Philips Medical system, Best, The Netherlands). For volumetric analysis, the isometric sagittal structural volumetric T1-weighted (T1W) images were acquired. In addition, T2-weighted axial images and fluid attenuation inversion recovery (FLAIR) axial images were also acquired to evaluate any pathological changes. For DTI data, a single-shot spin-echo echo-planar imaging (EPI) sequence was used with voxel = 2.2 Ã— 2.2 Ã— 2.2 mm; b = 0 and 800 sec/mm applied along 32 diffusion-encoding directions. For CBF data, STAR arterial spin labeling (ASL) technique was used. All processing steps were performed with using Statistical Parametric Mapping program version 5 (SPM5, Wellcome Department of Cognitive Neurology, London, UK). Group comparisons were performed with analysis of covariance (one-way ANOVA) for the GM volumes, FA and trace, and CBF with covarying for subjectâ€™s age. We used multiple comparisons using a false discovery rate (FDR) of 5% with a threshold looking for clusters with at least 10 contiguous voxels for all maps. Results : For the 3D T1WI, GM volumes did not present any significant regional difference among the three groups. For the DTI index of FA, FA in moderate COPD group reduced mainly both frontal cortices, right occipital subcortical white matter, and left angular gyrus compared with CN. Also, FA in severe COPD significantly decreased FA values in gray matter of brain as well as white matter. Finally, FA in severe COPD reduced in bilateral medial temporal cortices, frontal subcortical white matter, occipitofrontal fasciculus, and corticospinal tract compared with moderate COPD. For the DTI index of trace, the trace value in moderate COPD was significantly higher in bilateral occipital cortices, left hippocampus and left superior frontal cortex than the CN group. Also, trace in severe COPD significantly increased in frontal, temporal and occipital lobes, frontal subcortical white matter, occipitofrontal fasciculus, and corticospinal tract. Finally, trace in severe COPD was significantly high in multiple brain regions compared with moderate COPD. For the CBF data, sever COPD patients had decreased CBF in lentiform nucleus compared with CN and moderate COPD. Discussions: The main finding of this study was significant change of axonal integrity in multiple brain regions in COPD. Severe COPD showed extensive regions with significantly lower FA and higher trace in gray and white matter than control groups. Although there have been many neuropsychologic evaluations for COPD patients, little is known of structural change of the brain in COPD patients. A previous study of VBM analysis between COPD and control groups presented significant gray matter losses in the left intraparietal sulcus, inferior frontal gyrus, basal ganglia and the right inferior frontal gyrus (4). In contrast to previous study, our results did not show any difference of regional brain volume between COPD and control groups. Based on cerebral perfusion measures using brain SPECT, it was suggested that the decrease of the cerebral perfusion in bilateral anterior frontal, left middle frontal and left parietal of COPD might resulted in cognition impairment (2). We only found decreased CBF in severe COPD at lentiform nucleus, lateral globus pallidus. COPD could affect the diffusion and perfusion changes in brain. Conclusion: Regional microstructural changes of brain in COPD were confirmed by using VBM analysis of DTI data for the first time. The result of this study presented the severity of COPD and the cognitive function might be correlated with the extent of microstructural change in brain. Voxel-based evaluation by DTI and CBF may be useful for preclinical detections of the cognitive dysfunction in patients with COPD. Acknowledges: This research was supported by a grant of the Korean Health Technology R&D Project, Ministry for Health, Welfare & Family Affairs, Republic of Korea (A092125). References: (1) Grant I, et al. Arch Gen Psychiatry 1987; 44:9991006; (2) Antonelli IR, et al. J Neurol 2003; 250:325-332; (3) Ortapamuk H, et al. Ann Nucl Med 2006; 20:99-106; (4) Giesel FL, et al. ASNR 44 2006 Proceedings 287-288 San Diego California May, 2006 Fig. (A) FA, (B) Trace, (C) CBF A. CN>Severe B. CN<Severe C. CN<Mild",2011,,"list(name = ""Geon-Ho Jahng"", ids = ""3573589""); list(name = ""Chang-Woo Ryu"", ids = ""35405166""); list(name = ""Min-Ji Kim"", ids = ""2882716""); list(name = ""Hyug-Gi Kim"", ids = ""5597208""); list(name = ""Sun Mi Kim"", ids = ""46876784""); list(name = ""Dal Mo Yang"", ids = ""40226312""); list(name = ""Woo-Suk Choi"", ids = ""7378925"")",,,,,
00dd613e7585a67191197c25d6d6a0c83d2d0aef,A note on estimating the false discovery rate under mixture model,"Abstract In this note, we focus on estimating the false discovery rate (FDR) of a multiple testing method with a common, non-random rejection threshold under a mixture model. We develop a new class of estimates of the FDR and prove that it is less conservatively biased than what is traditionally used. Numerical evidence is presented to show that the mean squared error (MSE) is also often smaller for the present class of estimates, especially in small-scale multiple testings. A similar class of estimates of the positive false discovery rate (pFDR) less conservatively biased than what is usually used is then proposed. When modified using our estimate of the pFDR and applied to a gene-expression data, Storey's q-value method identifies a few more significant genes than his original q-value method at certain thresholds. The BH like method developed by thresholding our estimate of the FDR is shown to control the FDR in situations where the p-values have the same dependence structure as required by the BH method and, for lack of information about the proportion Ï€ 0 of true null hypotheses, it is reasonable to assume that Ï€ 0 is uniformly distributed over (0,1).",2010,Mathematics,"list(name = ""Fang ai Liu"", ids = ""91537802""); list(name = ""Sanat K. Sarkar"", ids = ""2756303"")",7e1504bbd2af7ff9b7f4568f3d3ff5507112c2df; 6d05318d6ac2b5b902adf7db160de523d5902430; 1629449886d68f1c020446d3cb9c3e94f3abd6b5,087f9482b1ad71e449c7ad758a3b235626168cc5; 21b6c1b4a61d4d2ecbcdccea88b1e290648c08cf; 18f677e5ee3f15a5531f45052a2bc78c15a800a4; 0acec919dfb7485853f190dcd77baf15a640e7ac; 3eeb4ebf8df49c48c779ebbdc7878290f21e56ca; 821c6660965ab4925d49aebffb40fd831b23a3f6; 156e7730b8ba8a08ec97eb6c2eaaf2124ed0ce6e; fcef2258a963f3d3984a486185ddc4349c43aa35; 3692462cd45f871e358242bece3716dd46f2f933; a535f8f48a38309e88f29d047c3dabfb76ab3e9d,Journal of Statistical Planning and Inference,140,1601-1609
9e06be0b3ea8387cdc3a92a28d09b409d0cea5b1,Distinct Metabolic Profile in Early Pregnancy of Overweight and Obese Women Developing Gestational Diabetes.,"BACKGROUND
Reliable biomarkers for gestational diabetes mellitus (GDM) would be beneficial in the early prevention of adverse metabolic outcomes during pregnancy and beyond.


OBJECTIVES
The objective of this study was to investigate whether the early pregnancy serum metabolic profile differs in women developing GDM from those remaining healthy. Furthermore, we evaluated the potential of these metabolites to act as predictive markers for GDM.


METHODS
This was a prospective study investigating overweight and obese [prepregnancy BMI (in kg/m2) â‰¥25 and >30, respectively] pregnant women (prepregnancy median BMI: 28.5; IQR: 26.4-31.5; nÂ =Â 357). Fasting serum samples were analyzed with a targeted NMR approach in early pregnancy (median: 14.3 weeks of gestation). GDM was diagnosed on the basis of a 2-h, 75-g oral-glucose-tolerance test at a median of 25.7 weeks of gestation.


RESULTS
In early pregnancy, 78 lipid metabolites differed in women who later developed GDM (nÂ =Â 82) compared with those who remained healthy (nÂ =Â 275) (ANCOVA, adjusted for confounding factors and corrected for multiple comparisons; false discovery rateÂ <0.05). Higher concentrations of several-sized VLDL particles and medium- and small-sized HDL particles, and lower concentrations of very large-sized HDL particles, were detected in women developing GDM. Furthermore, concentrations of amino acids including 2 branched-chain amino acids, isoleucine and leucine, and GlycA, a marker for low-grade inflammation, were higher in women who developed GDM. Receiver operating characteristic analysis revealed that the most predictive marker for GDM was a higher concentration of small-sized HDL particles (AUC: 0.71; 95% CI: 0.67, 0.77; PÂ <Â 0.001).


CONCLUSIONS
We identified a distinct early pregnancy metabolomic profile especially attributable to small HDL particles in women developing GDM. The aberrant metabolic profile could represent a novel way to allow early identification of this most common medical condition affecting pregnant women. This trial was registered at clinicaltrials.gov as NCT01922791.",2019,Biology; Medicine,"list(name = ""Kati Mokkala"", ids = ""48001557""); list(name = ""Tero Vahlberg"", ids = ""6408775""); list(name = ""Outi PellonperÃ¤"", ids = ""14320902""); list(name = ""Noora Houttu"", ids = ""26388474""); list(name = ""Ella Koivuniemi"", ids = ""50552918""); list(name = ""Kirsi Laitinen"", ids = ""3724282"")",a1133013f4b582c93220621ab78aeadf117c8092,,The Journal of nutrition,,
82ca4ab1db887a58e01e1b994c9f38db0eeb31a5,Adapting BH to One- and Two-Way Classified Structures of Hypotheses,"Multiple testing literature contains ample research on controlling false discoveries for hypotheses classified according to one criterion, which we refer to as one-way classified hypotheses. Although simultaneous classification of hypotheses according to two different criteria, resulting in two-way classified hypotheses, do often occur in scientific studies, no such research has taken place yet, as far as we know, under this structure. This article produces procedures, both in their oracle and data-adaptive forms, for controlling the overall false discovery rate (FDR) across all hypotheses effectively capturing the underlying one- or two-way classification structure. They have been obtained by using results associated with weighted Benjamini-Hochberg (BH) procedure in their more general forms providing guidance on how to adapt the original BH procedure to the underlying one- or two-way classification structure through an appropriate choice of the weights. The FDR is maintained non-asymptotically by our proposed procedures in their oracle forms under positive regression dependence on subset of null $p$-values (PRDS) and in their data-adaptive forms under independence of the $p$-values. Possible control of FDR for our data-adaptive procedures in certain scenarios involving dependent $p$-values have been investigated through simulations. The fact that our suggested procedures can be superior to contemporary practices has been demonstrated through their applications in simulated scenarios and to real-life data sets. While the procedures proposed here for two-way classified hypotheses are new, the data-adaptive procedure obtained for one-way classified hypotheses is alternative to and often more powerful than those proposed in Hu et al. (2010).",2018,Mathematics,"list(name = ""Shinjini Nandi"", ids = ""20962975""); list(name = ""Sanat K. Sarkar"", ids = ""2756303"")",2d9c75dbcd4b7d9fc6f82583521342ea63fbf925; ef4fd34d7cd9d5ad065367fd9954967500f5d334,6d05318d6ac2b5b902adf7db160de523d5902430; f8342f184985f75b8f903ee45b2d4d87a9469789; 4dc5a37d61e7dbd4d3d55f8679209e022ea09473; 156e7730b8ba8a08ec97eb6c2eaaf2124ed0ce6e; f8fdba9c7e718793981f32d0fc298a2702f1ede7; a099e74bcfc047a1cff5a0e18b9585aaed0ce7ff; 21b6c1b4a61d4d2ecbcdccea88b1e290648c08cf; 3eeb4ebf8df49c48c779ebbdc7878290f21e56ca; 3e4b19cb672ae3d3bd1949cb76f0becbd88355d0; 4526dd12ae002e047c1fcafb3ecb70c4bc60670e; e4d10430cab820cd6d09fd99f456c2d71bcdfb1f; c82e6dbd5b34d1ebc435c81a0e5bb774a6f7b998; 1ee765d218aaea7ef4d95df27043954fb7d3b4df; 42b8e76177e1501b122107999819cbee8b48f093; e71c757f71dbfc10c25b6305429c08eaf830ecec; 821c6660965ab4925d49aebffb40fd831b23a3f6; 2c4c300672ea8634f4714432cbd54d9f3f9d37b4; afc8c291aa589389e6c86407c16a5a646daddaaf; e9eda07d055c5a1bde88f3aef700fd201fc0be2f; f77f8fcab0c876b072a1e21c6ab2400cd3fac57d; 715580a7be4c1945b2ab608bd43dd4f718587643,arXiv: Methodology,,
