id,title,abstract,year,field,author,inCitation,outCitation,journalName,journalVolume,journalPages
d305330b516a2c4ff0ffec7a54f99124b1cdff9d,Abstract LB-267: The proteomic landscape of patient-derived breast cancer xenografts reveals tumor-specific differences in the breast tumor microenvironment,"Crosstalk between the tumor and surrounding microenvironment has emerged as an important regulator of tumor growth, metastasis and drug response. Patient-derived breast xenografts (PDXs) closely mimic the tumor microenvironment including the tumor architecture and interactions among cancer cells and stromal cells. PDXs provide a unique opportunity to study tumor-stroma interactions and the regulation of protein expression in the tumor microenvironment since species-specific amino acid sequences of the tumor (human) can be distinguished from the stroma (mouse) by LC-MS. However, quantitative proteomics workflows usually do not report species-specific peptides. We therefore developed a proteomics workflow based on 10-plex isobaric tagging to quantitatively profile the protein expression of PDXs and their associated microenvironment. Three biological replicates of seven breast cancer PDXs, representing three breast cancer subtypes, were profiled. Selecting only gene- and species-specific peptides for quantification of protein expression, we identified 8,113 human proteins (4,867 genes) and 2,251 mouse proteins (1,763 genes). Surprisingly, hierarchical clustering by mouse protein expression tightly clustered 4 of the 7 PDXs, with each of the 3 biological replicates next to one another. Notably, the 4 tightly clustered PDXs were from tumors with claudin-low, Her2-E and luminal B subtypes, whereas the biological replicates of three basal subtypes in the dataset were not tightly clustered. Gene set enrichment analysis of the stromal protein expression revealed upregulation of MTORC1 signaling, EMT, and interferon gamma response signaling with false discovery rates below 5%. We further investigated expression of signaling proteins in the tumor microenvironment by enriching active kinases with multiplexed kinase inhibitor beads. 152 mouse kinases were identified in the tumor microenvironment many tumor-specific differences in kinase levels. Taken together, our results imply that individual patient-derived breast tumors can actively and consistently orchestrate unique alterations in the proteins expressed in their microenvironment. Furthermore, we demonstrate the utility of our proteomic analysis workflow to delineate tumor-stroma signaling networks in PDXs. Citation Format: Xuya Wang, Petra Erdmann-Gilmore, Rosa Viner, Matthew Meyer, Tim Stuhlmiller, Sherri Davies, Shunqiang Li, Qiang Zhang, Arshag Mooradian, Kuan-lin Huang, Ryan Bomgarden, Li Ding, Matthew Ellis, John Rogers, Gary Johnson, Reid Townsend, David Fenyo, Jason M. Held. The proteomic landscape of patient-derived breast cancer xenografts reveals tumor-specific differences in the breast tumor microenvironment. [abstract]. In: Proceedings of the 107th Annual Meeting of the American Association for Cancer Research; 2016 Apr 16-20; New Orleans, LA. Philadelphia (PA): AACR; Cancer Res 2016;76(14 Suppl):Abstract nr LB-267.",2016,Biology,"list(name = ""Xuya Wang"", ids = ""48630617""); list(name = ""Petra Erdmann-Gilmore"", ids = ""1398775045""); list(name = ""Rosa Viner"", ids = ""50264228""); list(name = ""Matthew R. Meyer"", ids = ""47388148""); list(name = ""Tim J. Stuhlmiller"", ids = ""46234214""); list(name = ""Sherri R Davies"", ids = ""39904191""); list(name = ""Shunqiang Li"", ids = ""145960373""); list(name = ""Qiang Zhang"", ids = ""46324810""); list(name = ""Arshag D Mooradian"", ids = ""6433986""); list(name = ""Kuan-Lin Huang"", ids = ""1890516""); list(name = ""Ryan D. Bomgarden"", ids = ""5858630""); list(name = ""Li Ding"", ids = ""48082802""); list(name = ""Matthew J. C. Ellis"", ids = ""145946107""); list(name = ""John C. Rogers"", ids = ""144156560""); list(name = ""Gary L. Johnson"", ids = ""26886351""); list(name = ""R. Reid Townsend"", ids = ""49410346""); list(name = ""David FenyÃ¶"", ids = ""3297236""); list(name = ""Jason M Held"", ids = ""2356879"")",,,Cancer Research,76,
afeee06147e3b0c05a6a8958ab5bd16c56158164,Abstract LB-077: H1047R mutation of p110 alpha alters expression level of genes which are associated with cell migration & cancer metastasis,"INTRODUCTION: The H1047R mutation is the most frequent cancer-specific mutation in the catalytic subunit p110Î± of Class 1A PI3K. Our previous reports have shown that the H1047R is a gain-of-function mutation that increases colorectal cancer (CRC) cell migration & cancer metastasis. We have also shown that H1047R mutation may increases CRC HCT116 cell migration via actin cytoskeleton reorganization & cell morphology change. The actin cytoskeleton is a dynamic structure which is controlled or mediated by a number of small molecules & actin-binding proteins. The purpose of this study was to determine the differential gene expression profiles in CRC cells with either wild type (WT) or H1047R mutant (MUT) PIK3CA. METHODS: HCT116 cells engineered to contain either MUT or WT PI3KCA allele were used in this study. Total RNA was extracted from the two isogenic cell lines by commercial isolation reagents. RNA sequencing was used to identify the specific alterations in gene expression profiling of the cells. The raw RNA-seq reads were preprocessed through a customized analysis pipeline & summarized to gene level feature counts. The differential expression gene (DEG) analysis was performed using R & Bioconductor packages including edgeR. RESULTS: At significance levels false discovery rate (FDR) = 0.05, we identified 89 DEGs whose fold changes (FC) are greater than 2. Among the 89 DEGs, 49 are up-regulated & 40 are down-regulated by H1047R mutation. By GO (Gene Ontology) category pathway analysis, the H1047R mutation mediated gene expression alteration are involved in 26 pathways including cell migration, regulation of cell communication, cell surface receptor signaling pathway, morphogenesis, regulation of signaling & cell-cell signaling pathways. For example, the upregulated VCA (Versican) & EPHA4 (EPH Receptor A4) play important roles in controlling cell migration. CTEN/TNS4 was also upregulated, which localizes to focal adhesions & induces cell motility. On the other hand, the downregulated ARHGAP18 is a coding gene of Rho GTPase Activating Protein 18 which suppresses F-actin polymerization by inhibiting Rho, thereby regulating cell shape, spreading, & migration. CONCLUSION: The H1047R mutation induced specific alterations in gene expression profiling of CRC HCT116 cells have been detected. These changes appear to contribute to more aggressive cancer cell behavior. These results will guide further studies on the molecular mechanisms underlying H1047R-p110Î± mediated CRC metastasis. Understanding these mechanisms may allow for the development of novel therapeutic strategies for patients who bear the H1047R mutation. Citation Format: Guanghua Wan, Huining Kang, Scott Ness, Alissa Greenbam, Ashwani Rajput. H1047R mutation of p110 alpha alters expression level of genes which are associated with cell migration & cancer metastasis [abstract]. In: Proceedings of the American Association for Cancer Research Annual Meeting 2017; 2017 Apr 1-5; Washington, DC. Philadelphia (PA): AACR; Cancer Res 2017;77(13 Suppl):Abstract nr LB-077. doi:10.1158/1538-7445.AM2017-LB-077",2017,Medicine,"list(name = ""G Wan"", ids = ""145212775""); list(name = ""Huining Kang"", ids = ""6896003""); list(name = ""Scott A Ness"", ids = ""4083176""); list(name = ""Alissa Greenbam"", ids = ""83348584""); list(name = ""Ashwani Rajput"", ids = ""6373819"")",,,Cancer Research,77,
2911c2b0f286673ea24e7d7eb064b90724dc6993,Reduced mitochondrial activity in colonocytes facilitates AMPKÎ±2-dependent inflammation.,"Intestinal inflammation is associated with low levels of mucosal ATP, highlighting the importance of mitochondrial function associated with ATP production in the pathophysiology of the disease. In the inflamed colon of humans and mice, we found decreased levels of mitochondrial complex cytochrome c oxidase I/IV and lower ATP levels. Thus, we generated colonic Ï0 cells with reduced mitochondrial function linked to ATP production by selective depletion of mitochondrial DNA. In these cells, RNA sequencing revealed a substantial number of differentially expressed transcripts, among which 240 belonged to inflammatory pathways activated in human inflamed colon and TNF-Î±-treated cells (false discovery rate < 0.05). TNF-Î± treatment of colonic Ï0 cells augmented IL-8 expression by 9-fold (P < 0.01) via NF-ÎºB compared to TNF-Î±-treated control. Moreover, reduced mitochondrial function facilitated TNF-Î±-mediated NF-ÎºB luciferase promoter activity as a result of lowered inhibitory IÎºBÎ± (nuclear factor of Îº light polypeptide gene enhancer in B-cell inhibitor, Î±), leading to elevated NF-ÎºB. In cells with reduced mitochondrial function, TNF-Î± facilitated AMPKÎ±2 activation by 8-fold (P < 0.01), which was involved in NF-ÎºB-dependent IL-8 expression. Last, in human and mouse colon, anti-TNF-Î± treatment restored reduced mitochondria-dependent inflammation. We propose that selective targeting of this novel mechanism provides new treatment opportunities for intestinal inflammation.-Heller, S., Penrose, H. M., Cable, C., Biswas, D., Nakhoul, H., Baddoo, M., Flemington, E., Crawford, S. E., Savkovic, S. D. Reduced mitochondrial activity in colonocytes facilitates AMPKÎ±2-dependent inflammation.",2017,Biology; Medicine,"list(name = ""Sandra Heller"", ids = ""38448955""); list(name = ""Harrison M. Penrose"", ids = ""6997781""); list(name = ""Chloe Cable"", ids = ""39357694""); list(name = ""Debjani Biswas"", ids = ""8703780""); list(name = ""Hani Nakhoul"", ids = ""4821691""); list(name = ""Melody C Baddoo"", ids = ""5232580""); list(name = ""Erik K. Flemington"", ids = ""1956994""); list(name = ""Susan E Crawford"", ids = ""1864240""); list(name = ""Suzana Savkovic"", ids = ""5539632"")",ee487c0c2313ec351dc94231904cf6f80c247214; aebae5f5f777c53d1a7d120f324f36bffffe056c,,FASEB journal : official publication of the Federation of American Societies for Experimental Biology,31 5,"
          2013-2025
        "
0986d54c699460f848fd57f5a505a0e3e5ac3bdb,Addressing Statistical Biases in Nucleotide-Derived Protein Databases for Proteogenomic Search Strategies,"Proteogenomics has the potential to advance genome annotation through high quality peptide identifications derived from mass spectrometry experiments, which demonstrate a given gene or isoform is expressed and translated at the protein level. This can advance our understanding of genome function, discovering novel genes and gene structure that have not yet been identified or validated. Because of the high-throughput shotgun nature of most proteomics experiments, it is essential to carefully control for false positives and prevent any potential misannotation. A number of statistical procedures to deal with this are in wide use in proteomics, calculating false discovery rate (FDR) and posterior error probability (PEP) values for groups and individual peptide spectrum matches (PSMs). These methods control for multiple testing and exploit decoy databases to estimate statistical significance. Here, we show that database choice has a major effect on these confidence estimates leading to significant differences in the number of PSMs reported. We note that standard target:decoy approaches using six-frame translations of nucleotide sequences, such as assembled transcriptome data, apparently underestimate the confidence assigned to the PSMs. The source of this error stems from the inflated and unusual nature of the six-frame database, where for every target sequence there exists five ""incorrect"" targets that are unlikely to code for protein. The attendant FDR and PEP estimates lead to fewer accepted PSMs at fixed thresholds, and we show that this effect is a product of the database and statistical modeling and not the search engine. A variety of approaches to limit database size and remove noncoding target sequences are examined and discussed in terms of the altered statistical estimates generated and PSMs reported. These results are of importance to groups carrying out proteogenomics, aiming to maximize the validation and discovery of gene structure in sequenced genomes, while still controlling for false positives.",2012,Biology; Medicine,"list(name = ""Paul Blakeley"", ids = ""50977915""); list(name = ""Ian M. Overton"", ids = ""2203196""); list(name = ""Simon J. Hubbard"", ids = ""145830304"")",6746ea8cb7d3bbb8fd67e8245d6408cc824c187a; c9c10b6ea8f8356361b89a7de63fc2790c207622; 08a800c29f5839d128a462c822df2b414ddd6b7b; 6cef2997d7f66f5f9ab964464662675c7dec0012; 3c09d4d7c5dbdacfb21e8d11b595e9f15096ee6b; 06dc27b7a547fa3b9206204dcaa0ad8def3f9bdf; be17ebd20c35399cf3a99b150c71672befbddc82; 91c78d0f1505b5213fdb0eb737fab1122dfc21dc; 338acd3690bf35f3f4948ad2e550a694c1a29808; 63f3f9f8f4a3653cd3267b5b4435657b2bb3184d; ffd4535447be9e79665947fb7b2816f4aa905671; 46eec7f0283e99cee183283d2d783d066a4c3dc0; 7a9c87d483ba5785fe2314c3e54289e944b2b3a8; 9810328e95a97265e75b86a6b1bf504b9200495b; b9f956cb2e3395c180d9a90f507c535fe8dcc655; 32b366b680782689e89b53c5d276d21ed4e63889; 49efa1241fef27723539658007019331f3f059d8; 94d8f441ffe3555c075e06d4577ea5d9b556418b; f529818530860fa96c459891728ec5ea99f28df1; 8695e2d3849507131c233f50712ee35ed63c5b96; 12791ab287a5a7068b97cdab4fa0d75b05405174; faa0d26f9f41da3f2c29a895bef3a31e638aac40; d2e9fb5355ad7eb85c07a5d7a3df96e4c24b93b3; 8cdd128e5b86cb42cf42885808c445e8fe55d131; 21ce2676e7b83342e70aa6ea980240ab009ff0d4; 9f34b28193bec2da40ef565d85408f1c1c6f66c5; d843e51f8bc6dc20ea6b2dd819ec230b7c353ad7; d2f6fee08ca16a01285c4ae1d3846b30cb871878; 9a36e72fac08ac25ef958e60700be35d83da17da; 0c8477e3f08fc9c43a65002cd1f92df83bbbc872; a20e8c3b75324adc39cd0bb837f0d6e6de087480; c0a546afac963a79ec8318be97fb9b0c56a64ea3; 7d4ae1018da56138a3022880748de30103232254; 78161665b9fdbd5c2e9b8997d0789fe3f51e4c79; 4b62fbb307ce5b14b27efa3887e2937cf999bbe6; 712dece6f4de2285b48e1d71aa46ba615c680f88; 0dd3051345526593d2669ccdc4151dde260281d9; aa3cc8d08f7e0b7c30b6fa5bd848f60851b884a1; 3baf59ddeeab96b35f108e687db704951263aede,8b260cac57c371b6c53dd81df81870957b83193f; 17336ffd1b528b998054118fb999b6a5afb58014; a0436fc2001f681e465c87b478f35798fe56c4fe; 8c1a1e761b715b23668b4f850e2bcc958fa21ad2; 4b21a79a9d6ccde9807726040d559979a6e1a526; 42cec4727585098e6cb02b8ebf5979183fc3bf41; bc6db247b1f1c16483aec812b5199e9285e0ebc3; 3e17047a518c284f04f0befe648f4a9e364a0725; 923646e4b41f48c5706c4cdaddbc3aa8ef402558; 821c6660965ab4925d49aebffb40fd831b23a3f6; 626f20664b982faa458e34f8df4ba072afcf2834; 216a4107a4b1d0689f6fcffcb15221bbacb7e198; 6100187f67a65acbb82675835f14b1d4ed4f0ede; f390e53848813184a170766b4d6dcbcb4d1aaaee; 518a267f9a2c7c3510075612fc46a2c8831e3a36; e6ff5a0111a42c5ea20f7ce9716024047cc694c4; 1b03414ebace3aae831362dc3ab07619e1ecb36f; e58ed3d9b4352ea955ce28ff6102e96c74d3ca5c; 10aacee6e204b3683346dee1dfcb16ffd9ac6e63; 14a9f176a949b39aba3b9705f78d608dc3b81f67; e9477c8b0e0ec694860eb4efd8c89f3bf5c44fc0; f09d4a533a221b9b85c591ba1dc862dd2fe808a1; dfc6410dc8c4aab8f5afa07ea9a5d9592c9b6b51; 36181310e29fcdb144ee07c93764b41503400e6e; acafade0fb309c36905f1fb05b3fd0646552c96c; 233dd4127b57fae0a4da65e809d7816f87cc20cf; 7d56c535fa6b1fbf1f3bd013f20cbd3b2e972bce; 9e297f34976b728862a6ccc9f4f74e0d356230b7; 2551f5f20953719f91d69344cd023d78ac591c4e; f25e95c0e9f9f7adb50b31beea0577774dbfd5c1; 67c82561a0a7700a447332159bf5c310af948bde; 2bb528eff6fbba44955c726479fab52e9008e7b9; 958f528d1df0696831bfe7b75a1dddfc546de560; 6798f8080d5a675a5ff091847bb39ceac6198a79; 0593d66a126e15d390a6c7ccda22d7432d7dc22f; c93414ec13918fa11e4a392803da14196b0caae5; b4ec761012ef5674c8a2f4d234d4b6991948f17f; 987718b23ff0c27c0cd99702ede5bbfd52b2ee93; bb742a0df1742ef19166e64eec16315412e03e34; 31222d416ee1d735e7c305ee8295c710b2e53205; 5a1b41018c2528eeb96b119081f3e0176cd32e1a; 7769bbfc30513e11c01810d6ebe23b41142ff49a; ba0d3a10c57f03bf6ac43589413a57a5687f4c0b; 560463880942d2ec1b760ec386d8c0c7c6cd8dbe; f076dac18a51a96566793fdc8c90d0b6b772bb0b; e9d32551af69852b2adcf1a5ca4c89e98eba221d; 9a27448c5abe0266c43d1f41e25a4ed41ce7ee8e; 0f5751f76cef4a502b22ad088c381a4d0bb10121; edb8c7ca69de4e5f8054dc107d8986c07a2adc2f; 84578ee8c68ecdfab7c0f85bfd5e576b5b20347c; 90b895b470499711b4340a31441bb012db989b6e; 1ef83b2b980b406db708adb6104533be05af9854; 8960a8feff354818ff5e752ebb1937cbfb553dd5; 631fe3da480f8d903f574cfb89f6d06c1cef6947; 3ea335f6737c225d5e93890aa2e26dc35570fe1f; d57dd6786533d877e5f8b1290843d0376ddde68a; 9266263c7ec94382b00aa770aa6abf51c99c95ee; a68964ba111c567ccced619105551b4c43f99393; bb7dd15bd2e6d008443c2546db77b63a01d57bbd; 82519e72247a21dd7e6aa87c4b282bf0055d139c,Journal of Proteome Research,11,5221 - 5234
0d64cd8f03f5eda75188d5be0374432450c2da3c,Dysfunction of attention switching networks in amyotrophic lateral sclerosis,"OBJECTIVE
To localise and characterise changes in cognitive networks in Amyotrophic Lateral Sclerosis (ALS) using source analysis of mismatch negativity (MMN) waveforms.


RATIONALE
The MMN waveform has an increased average delay in ALS. MMN has been attributed to change detection and involuntary attention switching. This therefore indicates pathological impairment of the neural network components which generate these functions. Source localisation can mitigate the poor spatial resolution of sensor-level EEG analysis by associating the sensor-level signals to the contributing brain sources. The functional activity in each generating source can therefore be individually measured and investigated as a quantitative biomarker of impairment in ALS or its sub-phenotypes.


METHODS
MMN responses from 128-channel electroencephalography (EEG) recordings in 58 ALS patients and 39 healthy controls were localised to source by three separate localisation methods, including beamforming, dipole fitting and exact low resolution brain electromagnetic tomography.


RESULTS
Compared with controls, ALS patients showed significant increase in power of the left posterior parietal, central and dorsolateral prefrontal cortices (false discovery rateâ€¯=â€¯0.1). This change correlated with impaired cognitive flexibility (rhoâ€¯=â€¯0.45, 0.45, 0.47, pâ€¯=â€¯.042, .055, .031 respectively). ALS patients also exhibited a decrease in the power of dipoles representing activity in the inferior frontal (left: pâ€¯=â€¯5.16â€¯Ã—â€¯10-6, right: pâ€¯=â€¯1.07â€¯Ã—â€¯10-5) and left superior temporal gyri (pâ€¯=â€¯9.30â€¯Ã—â€¯10-6). These patterns were detected across three source localisation methods. Decrease in right inferior frontal gyrus activity was a good discriminator of ALS patients from controls (AUROCâ€¯=â€¯0.77) and an excellent discriminator of C9ORF72 expansion-positive patients from controls (AUROCâ€¯=â€¯0.95).


INTERPRETATION
Source localization of evoked potentials can reliably discriminate patterns of functional network impairment in ALS and ALS subgroups during involuntary attention switching. The discriminative ability of the detected cognitive changes in specific brain regions are comparable to those of functional magnetic resonance imaging (fMRI). Source analysis of high-density EEG patterns has excellent potential to provide non-invasive, data-driven quantitative biomarkers of network disruption that could be harnessed as novel neurophysiology-based outcome measures in clinical trials.",2019,Medicine,"list(name = ""Roisin McMackin"", ids = ""72901458""); list(name = ""Stefan Dukic"", ids = ""34099534""); list(name = ""Michael P. Broderick"", ids = ""144359318""); list(name = ""Parameswaran Mahadeva Iyer"", ids = ""4164621""); list(name = ""Marta Pinto-Grau"", ids = ""1402536044""); list(name = ""Kieran Mohr"", ids = ""29200878""); list(name = ""Rangariroyashe Hannah Chipika"", ids = ""35494561""); list(name = ""Amina Coffey"", ids = ""83747353""); list(name = ""Teresa Buxo"", ids = ""72226816""); list(name = ""Christina Schuster"", ids = ""6727536""); list(name = ""Brighid Gavin"", ids = ""38639916""); list(name = ""Mark Heverin"", ids = ""3830768""); list(name = ""Peter Bede"", ids = ""5856749""); list(name = ""Niall Pender"", ids = ""6065584""); list(name = ""Edmund C. Lalor"", ids = ""2138502""); list(name = ""Muthuraman Muthuraman"", ids = ""2802652""); list(name = ""Orla Hardiman"", ids = ""49346786""); list(name = ""Bahman Nasseroleslami"", ids = ""145757570"")",73e743bb05af3adfc228e9a5bf160199422bdaff; 71702df9049e4212a3f50dbad17960e6e39dfca9,dc0e055f84308dec8f9d1acb3d91288ed7246838; b4941f07f46c9bd701505325c0aa2f7b631219fc; b763fbed99ed35bfa11a95be10be2d04bd68dd0c; 2033998a7179b8d98c1bdc2b32d21929912942dd; 79bc4c3bd1f852fea9cc06c6af7acc7ee1db15d8; 3a106ba31d5e0f065699d17303d03f85268e90e3; c92d3a5283a6c489d5e2b28170067543bd9be2c0; 2cc16fd610cb4029b3224f0f86cee3faede9d100; 276b505342a259fc507e6c7f1107b53c9b3efd5f; 877b0b3a0bb45b29d5b3fe47105b6c9322ef174b; af149a26fcb845f69970e357a9802b3e1512dcc3; 27df471308b977a0afcecc9e802f5d1dfeb728ad; 3209b7e1dde59a28b7452e19b884d45ccb1bc704; 5bc7131a888e59c127f8b4bf8c082235e00de41d; 5efd4c630bca9e60c48848c9e8500b370e08e714; 2eda7ede68dac52e32065c72fbdd6ae67da36e10; 18aff00d37ae0f2af485109092dbbd3a1969cb47; 43903414ffd29a035b785cfa8afd382aba1ada2e; 7a024d4dd083fe55b54cb626175ed7a7fb84e637; d304676f7b33546e1df8bfaeeb86821a88b75fbd; 169017ddfaa36211cc3e71f4e73bb32b34fb7daa; 01854464ce06a10aa94ee4b1e32b641aa1d6e050; f3989c600dc7e2594283396c1392ec8649888a71; 4eca8dabcf300b9d7e2cee2733245e0d489f96b0; 7a05088a6562cb35596a89e4d58d613558ed1ae7; 7fd8bee2d3a38b29ae2228466d3431a34c7ae240; 77c8215454d5e24bf1b6b639a2b45d4dd9ebd412; 2230aa1127b836c11b3b7acfe3dd2574adbceab5; 03d61a33796234b8bae5ac38de9b26c1c5ed9e2f; c8fc91fe84a92c64a3b590491f92699911059881; 78ab66586b7e88e6dfb602d88188827d5435a7f8; adf337cd6a73693c3fd1b5f218176c40559f0b15; f892f0e611b4ecaea9738eb06cbb9531f449673a; 74acb2730412f7a23f5c967b3e7b4318e0534395; f1083e7f020681efeb75cd408b38078ebf8e17f7; 46064fe6c3539f623234ad98b2b57cff56fcb85d; 330994242111f877b4ea0410a5c8ae1adf8e06b4; 57b5fbfa5e7176be002759f26ce64d20533a7487; 1c7dbeb48201478e852fc4f4a2e80078670d53c1; 409d4894e0b0602c731115bf6013a16f31bd1b5f; 96dfc3240943ded705537b66dc70a6e46b74852d; 0050ccb50f82bccf63c13d4bfbabb590121c10af; 66f7e84626cb4b22de0705878cb19f30589346d1; 7c7d77baef9df11d3006d39e8474946cfb8045ee; cd309ca6d59e8ddfc6f24933f1a56a4197e27bb1; 5e83294c8617cbd4358a898144583979b0111ed4; 6e47f2a58c2a8aa1e247b5541590cad63657768d; a20cb7655ebb1ca24b2a41cc330d242eda643257; 607cadfeefec31d98274272cbce2175b18acc102; 593e5c0f33c6eb6a2c3600c4e1ffc79525fefe37; 86cac231dd9e49acf8e1bcb67eca295d9dd72cf3; 2d8bc065924c4729e15b565eca0e7b06a8077b2c; a19ecd79d0a9b6c7d61c424569a0da474b6188fc; e75e9e08b17f8d276605d7f53d8244325d7006a2; 86266a0c072425c2baafb8f467b3ae8444de880f; b8ed6d72b31efa719b0490bdb365b0d98b469b2b; 36a092adbca0c80cd9882619d8a0d6ee0907a0c2; 8e59df6c09bb1ce1e2f18d229778d807f0f1b64a; 7012574604ec38bfb4097c3d81059155f33780e7; 125c271e826cc1e6eaa6b701f055c950413c46b8; b4a2bb2b4191e285cd10fd25bf2580775695fc5f; e034feb42f551591d9934c631bfd2be772ee5686; 750e1c6b455bd85a4c1d1802b37f6bf050e88d28; c44aeeea2cff89f086ae2dc107797ee137707458; 6b0bf2c6070b54b9e2e92baf17516c0ac75c2650; 02f35d0ca8b3edd48f5f3bfcb1c4e0cd632a54b9; 8426bccc943ca18e339c562bbdfd2e0c5b4de520; 3ab9f5684c79ab4ac27eb0d1f48ef9415861abd2; 21e57e73a9045c822fdcffa2682e937044fd2881; 51782db7ec7da5499d688842cc537b0a920d497c; 5cbe47273b9dbc49985b5fed54198bd143f28101; fe7ed94b9179507ba42b8641a87f8c8cb3085c34; 648f4ec5316ac095e3c9966d9a353e133a10b153; 358024b3970eff70b1ce86214ce704d519940391; b3476fe333791afedfdaf22e30c5b66f3fd76776; 004642370ee208f911281e114543b568047e6651; f316caf9ef9cf62fd320dbe52b3b3e675567d18e; 1d392b4e8e2578713e2729f8475569e44d4168c0; f5390da28b074b9ea24f39ead05f68a0b658877a; 8129f19ccd3cfea52fc8f0524e81136d94485b62; f4baf6575865d5b529502ce6373adaeff3016db2; f3031acf4519df69e6d62bf10958f78087c3c9c4; 5b304413b843b922a3c6f422a81cfb661587aa7f; d15461404f79284aa1f9b714cd171cfea3700f77; 27bcc5e5818760b00fd8dc39fb8f2f8c59222e4f; 2daa9685afcae79a798fd7a6ce48344bfa32037b; e93832c457f91c94ea45dcf9e7caa64ecba5ca9f; 83c6c45591ae33e9e65578a23610caee17bc4ecb; a431458588753c24d74363cd49910e5480bf247e; b5f45545a3d03e84b6d114ae57459f93dfe6bf5f; 26e0bd7d998043dc7073576ee646ab1ce0300375; 02f132aee4efdd8007c113162bc900b7cff625d0; abf6b474e7ddcfd5d16a5eb3a5f28b8e7c3f0a75; 39559487f6a45e66416b1b96dc5ef69e1aacfc20,NeuroImage : Clinical,22,
