id,title,abstract,year,field,author,inCitation,outCitation,journalName,journalVolume,journalPages
65625b6b22192fbef42d698bfccc2488ab46994a,Detection of selection signatures in dairy and beef cattle using high-density genomic information,"BackgroundArtificial selection for economically important traits in cattle is expected to have left distinctive selection signatures on the genome. Access to high-density genotypes facilitates the accurate identification of genomic regions that have undergone positive selection. These findings help to better elucidate the mechanisms of selection and to identify candidate genes of interest to breeding programs.ResultsInformation on 705 243 autosomal single nucleotide polymorphisms (SNPs) in 3122 dairy and beef male animals from seven cattle breeds (Angus, Belgian Blue, Charolais, Hereford, Holstein-Friesian, Limousin and Simmental) were used to detect selection signatures by applying two complementary methods, integrated haplotype score (iHS) and global fixation index (FST). To control for false positive results, we used false discovery rate (FDR) adjustment to calculate adjusted iHS within each breed and the genome-wide significance level was about 0.003. Using the iHS method, 83, 92, 91, 101, 85, 101 and 86 significant genomic regions were detected for Angus, Belgian Blue, Charolais, Hereford, Holstein-Friesian, Limousin and Simmental cattle, respectively. None of these regions was common to all seven breeds. Using the FST approach, 704 individual SNPs were detected across breeds. Annotation of the regions of the genome that showed selection signatures revealed several interesting candidate genes i.e. DGAT1, ABCG2, MSTN, CAPN3, FABP3, CHCHD7, PLAG1, JAZF1, PRKG2, ACTC1, TBC1D1, GHR, BMP2, TSG1, LYN, KIT and MC1R that play a role in milk production, reproduction, body size, muscle formation or coat color. Fifty-seven common candidate genes were found by both the iHS and global FST methods across the seven breeds. Moreover, many novel genomic regions and genes were detected within the regions that showed selection signatures; for some candidate genes, signatures of positive selection exist in the human genome. Multilevel bioinformatic analyses of the detected candidate genes suggested that the PPAR pathway may have been subjected to positive selection.ConclusionsThis study provides a high-resolution bovine genomic map of positive selection signatures that are either specific to one breed or common to a subset of the seven breeds analyzed. Our results will contribute to the detection of functional candidate genes that have undergone positive selection in future studies.",2015,Biology; Medicine,"list(name = ""Fuping Zhao"", ids = ""21733666""); list(name = ""SinÃ©ad McParland"", ids = ""4603022""); list(name = ""Francis J Kearney"", ids = ""35755161""); list(name = ""Lixin Du"", ids = ""2618248""); list(name = ""Donagh P. Berry"", ids = ""145937284"")",4060d9916838d5b02a853ee45656b04fd9502fcd; ad237707aebf7529c05bc9168d967aeed83cc48c; 00a7f6c0619274e2dac47d53b479a5384543188b; b4461b9f5a840c19b28c001e6292e0be769bdc5c; cb498db5dcaa9083bf67a01f1538e87ecc569663; ed4fcf4a21bbc85cf5db3138e6003ed398228d4b; 82aee0dda86d221b313a37e6a76e76dca88429e7; 82978258677493c67f99d851825ab6eee5a73524; 11c8bf61437e288c556a1784c44db4c600ea951d; f71811ea62c660b53655a7fe3126456304ca1540; b90f32349f41e68d25b492155ca9bbf090cadaad; 88a9baf6b534fd6e467f3b754467d2b42ed88024; e22ef4868fdad7a0e6630c87f9b6d47d802f218d; a9458c367d7f1b205466e68d925afe468504c74b; 2ca85ef5dc8e7d5165bbbf7c11940a78288fa913; 0ff0f4d4d212d4bd16d653c63b09885ff35048ba; 5f90cbb6bfe62d8f3d75fceb42d4417b3586661d; 560cf8d55904a9b012573094bd500b509aa53644; 6595a4c376af3f4c65a640c133cb5b9d9d3141f3; 048820b0ed17da9b122ce9130c0568bb9e735729; e3f4ed0371283bd906fe3c923cc48bd66f4fa784; db1fb7e954fec1d5411865550f26480c76138829; 62ff2fde579e3b3328582bffa09013c51c1333aa; e791d42d9c725a22decc9ac83ed399d05ab1f3e2; 5d40e0a4a3caf6000b6394385013c3227249d6e1; c69fffe2001d5845d8bb6435d69a7791162d6a52; f728720a922bb05a29de7abc33dd849a18c2caff; 2b5283584ac998b93b9b90ad029e44db4994f70d; 2b483cf3c00883e17a64b642c79a10495156071c; c971853765596df5d0fb8fc3dafe852f7e4f77ce; c475097008be009990d04b68e3c11ec58085f480; 6ad7574d2170b0c1369c990bd20ce838533443f0; cae5cfdde457ba76a003b22dab4c1246a901aa94; ca127b28b2a572df4aaa4ca9ab01f9ba9396c1ff; 8d0423b81f75d70687b7321bc8ae686ac29cf494; 83f06db87d747a4ff9adf2f1e0a2003090c0f441; cf481ba04b071d905e3a6b0fb8c19a71b3eecdbc; 574406f9eb4749da3bdb16a14318f4a960c504ba; b4cb78e0a0ac8c1d3bbe32c43c6bc119154dbf03; 1e9d43f379a1cff3d85d58dd1276af37fbfcc803; ea42788aa4f80c60e6f6bf478ba261b4e79b8671; 32956051bc3172d50849f479227758358fb70757; 55ef70a19e2a6b6ac0e296ef5ba05b2705465e58; 18277acd93d665eef6c4e9ca2d866c4c18e2bc52; 74c6f29a05f460749f852b9589c8ea1245e53b3e; 9517cb91438e4bc35d04f6168651ec114561b9e3; 6a3d18901a18e1bb6f299aeff59409ca6cd3776c; af8fb012188af083c55ce01c18d9d1972cbbc443; 85914cf89692d5799bd48f5ca24598a0bd9be09b; 0e23bb436380d3c4b33adf5c23eb59f4404b45cb; 4d0f858af277fa25a56fa27b45ce9ba268d3792d; e600aa8fd0bda66613f936d6c9aa4d994046fe25; f8f9c92a29434e10194f0701c1b17495a1b6aa09; 13a33ff5403842b213473aa870f4f37e6b4aaff2; 81ee787d8a4e0da8cdea7957aa3f962421d9da2d; bfe2bbceb0b4229aa906402e78acc3d4ca973397; b5b9d2a7883909a55dc4baa889933c0870e78fef; 8e99f05764e5ea1886a6b32071d897204ffa74fc; f810bc3104e5d331a1b63fea43d6b16e3bb1c15c; a5a8691366ffb75dd47798c5eecbb59c68662350; 9831681f7678b10a2c074aa5d47abe63916983e5; edd48db90600058636aa0cd3b4845e322f260f42,74f662f459e262eca34c7ffa5a293ba614f44849; 5d6637132a0108501085b4ce37ea2f9816ddf419; 5d8687679461a8957257ba52d5914e7e215b3971; 297f40f7fb339fc66385bc298eedab747e18ecda; 66427e1d5dc915ba4acb5ab3eaa76104265bc219; 77861d579192b4dbe0d452edf6c8f8dfc0494a49; 29a4a43f9edf5b8227d3160cd86a35d964a781d1; 89e8793e96cd40f88383dc49320b478a0698b07c; f72ea909dc07e2e3ab326def16e88e20efdf022e; ed1d0e09ac7a5a186c4d41360cd63a3c5690d0d7; ead5bbbfc12b6501646cabc08b187e318e3c78de; 3b90b5da57ae7f0302632006b81936d4aa2e0f0e; 22c5046de1e4191393fddd8428ff99c2aa40009d; 014c619f1985a7903017703a7f69b3a8f4f28ed1; 9e9038197adecd985f883ad49a16ca8c6332aca0; fa60b6806050255a77699bd0f9f5d824884c5162; e7cd2fda8c3fd2753f0c6623cfb6f2ea82d15e89; 2e4647823e17f26358c884d60a84dd7d25a4b199; 3f7d6afb5c152ee828e0f1e94d7071b91d7b78a5; fec772a7cf60fea25932ce04439e71e492d684c0; 9b8c6a1ba1966b481235afa06bb646ef240cae38; b7ac53ca8e72f5645170719cc3fdddfb1bb07689; f41fc5a21a2a9aa55bb62ef3a2b5dd9778745f17; 33ac23c4bd4a14e018da68e5480caeb1988a01b7; 2d59f825aa639be6c677c9981333362328474e5b; c8dfbb8992dca1aebbdadbcaf42ff02f78b6b39c; 6126379e9ffbf088fc5cf838ba53a9b95526d0d5; 10a624b898873ca8af624179a3a806b89e69dd8d; 83fe889eab64531f36d5d3a47019b09200b6ebe7; 188980ba192fdf08ad32eb26073c3d6e1c7a950d; e8d7f15d4dfa3f1dc19892a3128b77ca0cceb087; f5a4e2add36e092d7941a5e9a7f613437505d065; e633009ad5dde3d8045f1b62c6b0098091f9b55b; ffda6951cf1f1c9cad400abef65bf34c6130e9bb; c40d81331505dc60ff08bc14ae38f24265501e74; 7f4fbcdee37a7a79ea6d7d55d491319871290218; ff4e9759058f068c3cdbadadb21363134008633e; a5b3a38028959c23be2f0acdc60d3e2762b88596; dc965cec5e17db39602a8924eb1dcfc8af894d74; 35b3fea04eaf936402db47d16fc3763862ee4e5b; 507e35e4722f73add7edc0edaedc0adb06d03e4c; 9da31ea13545caf23152aca6c5831294cf8ea2a2; 639c0040e271d1f317e8bd130216e0d60f0652c8; 36ed1c1bc630e6c25738dab9a2324148bf6b5771; 1149e0b72f861050cc3f0c4c90e392227aa1b40a; 9f0f5ea38977e81e44cb0ac76c6cc1f3afa7b7aa; a060494fdb687f13c644dfc2b5bc1468b2bacc21; c9d3276b81b14edd3c7b1c0147c22add6079444d; b97615af7d0e16d1c4ecfdba9de4183b17efa05b; 2366cee8ccee5c7169dfbd437307f80ffd2864f6; 9a39e80d9bae8fb7b6b087c32e8357e2b9f101b7; 666f67748078f058cbf2f20543510b4f715804a4; 6d10d611fe89613915bb979d1a5b421538d70c4c; 431b3b5eab63bcf018aa5fd819bca5293a97ae75; 2d0d980fd7e15ce884f67226d9b4c3d62400cef4; a749ec62d0edd2dc7d5511aed4abc1b671736906; 1ef6b03be024c1b54ae48cdd8bfc28edb0824cdc; ac28af8ba027ebf92033ebab96b06ef9dc7681e8; 3f2cc4a5d9c0b881410b008ecb43da2daaf741ac; ee566595ab0723b458d4081532006e23e7135b71; 4c6c3c6768099a55eb7892399a10ed195f8210b6; 4d959fce6817d2eb7a60b8568bbe52235854ca3b; 05a7b8c135d93866101ceea2c4193375e940b0eb; 768c4f6fe67b77b1ab6c9ac115a271aa26e936d1; 2c9a9c4c96b13938639a14304e300854b2457c1b; 326581abd3371faf63fad44f6c31b833854cb37f; ad7cb7c02341943adc6406a35836e119e771edc4; ee13011457f6723edbe1b6ab4a22459f59e6214a; 93825abdd333cea7105201c068c6e6b50f6028d7,"Genetics, Selection, Evolution : GSE",47,
708d4c637fd8645fbbd0dfd0a529485e34bb2c79,A weighted relative difference accumulation algorithm for dynamic metabolomics data: long-term elevated bile acids are risk factors for hepatocellular carcinoma,"Dynamic metabolomics studies can provide a systematic view of the metabolic trajectory during disease development and drug treatment and reveal the nature of biological processes at metabolic level. To extract important information in a systematic time dimension rather than at isolated time points, a weighted method based on the means and variations along the time points was proposed and first applied to previously published rat model data. The method was subsequently extended and applied to prospective metabolomics data analysis of hepatocellular carcinoma (HCC). Permutation was employed for noise filtering and false discovery rate (FDR) was used for parameter optimization during the feature selection. Long-term elevated serum bile acids were identified as risk factors for HCC development.",2015,Biology; Medicine,"list(name = ""Weijian Zhang"", ids = ""47527829""); list(name = ""Lina Zhou"", ids = ""145351910""); list(name = ""Peiyuan Yin"", ids = ""31621928""); list(name = ""Jinbing Wang"", ids = ""6888863""); list(name = ""Xin Lu"", ids = ""145574672""); list(name = ""X. Wang"", ids = ""48630736""); list(name = ""Jianguo Chen"", ids = ""37719909""); list(name = ""Xiaohui Lin"", ids = ""46520023""); list(name = ""Guowang Xu"", ids = ""4773978"")",3ce899566dae857b49a943074a5787eb3a0b0c28; 8c1e8be7ad3028fcd7d361abf615c9c5f2fc316e; cfe664160c661d4e2f32e8d4dfcfbb9b3d3e56e1; 29c2c2d2534825296535005b7e9969457d3601eb; 87099e2848085bc2d7072bc35ae0a0a2962429d1; 42a00d2ea7e790ba61ea765a31af18435856a6f0; 79e64c040145ae8771e645d6693788bb3d707f2f; 06181444b1104d90f8e28d4ff95fe86199d8368b; 3ca35257cabf1cfd97ffb8bec4a62a4cda886731; 12f1f00daf58031abcd3c7ababf46d555c938017; 34e0ec76a1f52d912f6c6ffe687a1d476ecee834; 74dab5a2d6dd96fdfa5b1eca79606910e711e75c; d2534088f55270e68b771dbe3ed9aa253ab2bc04,dfef76d3229a4be4610dcde328f1ccafaf91844a; 59b566b5fc505dec41246ecfe31770d781b19ecb; aa13daecf6d7924faec4b34e91ce79b1471aed5e; 7ef17f490b424b5e5a97cb1c42b937e358ddd40c; 8102d404603ebb81a1813459eb641e812d61ed0d; 950b77d12c78ef4a4ea3795b1787b861947ec078; a87a8863843d5e04c0875611ba2f3c27a83f0094; c4d505319a913d959bed688484e37994a7671946; 5c08ccba51c040a48907d3d9ab997c43bf17c43d; bf4b444498dfcdfd3b5d6d9724fb3e0b603606d2; 1b3f36ea4925e7483e5e0a76660778274b74c106; 98241074cd3f61d0fb5a7c05e7ccbaa612d6d502; 052a810ecfd6796170ac9ab6c7be947da2451c76; f45e33694d5d7d1958529bdaf39a56009bb3a082; acd9ef8fca71fcc352c04a3eddd79935ad00a278; cc0e0ee923806720cb5667651eecd0df37ba2cb1; ea2537be2e787b40e63decda0f565bf5f61a13a6; 59640d08616af089de6cc7e6a8957982e51dd54c; 1ab1d7cb02a144e727f56a8cedfbf485b2503b22; c9d8c4f12f55255770e1ba420dd6ab9b2b68f456; 9c8a81e1e9ad0926170c09f63c13c11752dffa2c; 9157970408f931a45a7d245ac909ad7f1c2558bd; 47d4f5eb58556c6f61f033871b2680414b13e61d; c7a36ad7addf09e9298da6c263bbe03af3114ae1; 60a2e0715bdbd512f412d0bf9a0dbd6aeff78a5b; 3aaaf1429c0623550ee213f75c293fcc30ad1451; 86baabce344736083cb923aeb34f870d34ccd23d; ff8baabf6ede9e9b54828389f11144f4ee4fb227; 5196fb354a78993dd3328ad4299be2f06224917e; f6f8d9cb0133845753fd04d5186b8bdf411ecd2f; 40f7cdab63f74ad3a515fd10db0384a51fb33602; 18da15ae2bb3039618058b582b75d4badfb079f7; 21c41fcec6ac8a7f55c539ac199247f200633753; d8879569f1fd93e169a7953163d10f9c6eb253c3; 703f348aadc444e8a0ef5557fc6fa880bfe3e859; 24d5a07e52b1ef5766869b7ab53dc56f63d02df7; 44c52f4c4ad277679ab500f92c3a6cd2e5923f0b; 0e52991e23791759eb1ae41457a2edbf44f98635; 5d80cf406d7e2432ce9875ae1d2571e4eb46dd5c; 8cb5e285decd7e10b9346e5b64e055f6b940c1d5; 34cd3d41bf66cd760aaa74f9bcf15e869b8aef82; 50c92bb35df1f50bc42e6c49f2f876853024bf4f; d46f6449d8df4ef1cc1d9dd6d8ed99817f9c7384; 5ecf9a4b5539e52596c0a5c20f50e7aad1063fed; fabd404e631e377deb96ae78c9002b97d3834f6a; 3ee73f2bf6cd154efd65783be0761cb6b7478196; 010471df2a69dfd05e084b1d0c0b24a9dbb73714; ab58b1af38f93602dbfdcf7ba9125b9cbfb5b8c3; d10ff6393431b90ce06f4e9ec00fd5f06f0a6e26; 32e7ffe264e9ee85f04e6413cf847b7b6d0ce4bf; 063f05da5c70d6b99c3658cdfae8a7e9550792c3; e50fd8cc54f6282e277143f12631582dcf219539; 824e90400d9943b08d9116af22d36a6a25e955d9; 37ccf211087c91b2ba5701a245f084161874bfc0; cc5b2da42564e76a729d00194d6ee80db9f198b9; 7f1bfa9e65a110f529c544c615852fb10454aa67; 365becee217da7e86c0d9b794e1e2619f30a5656; 8cc3a88faaf23f1328be5ca2f29e136d3cf70b33; fcef2258a963f3d3984a486185ddc4349c43aa35; 1b0b2f6f28de136b8ad387f86823503fcf58c8da; 738f38435c739ea1d9b32a3f437fd9ac28b58726,Scientific Reports,5,
03f5ecb594fc36eb80d037b72f2208020691d5a0,Comparison of surfactant-assisted shotgun methods using acid-labile surfactants and sodium dodecyl sulfate for membrane proteome analysis.,"Three surfactant-assisted shotgun methods using acid labile surfactants, sodium-3-[(2-methyl-2-undecyl-1,3-dioxolan-4-yl)-methoxyl]-1-propanesulfonate (RapiGest) and 3-[3-(1,1-bisalkyloxyethyl)pyridin-1-yl]propane-1-sulfonate (PPS), and sodium dodecyl sulfate (SDS) were investigated for their applicability to membrane proteome analysis. It is shown that RapiGest is a preferred reagent for handling membrane proteomes of Escherichia coli and MCF7 cells for liquid chromatography tandem mass spectrometry (LC MS/MS) analysis of tryptic digests. The RapiGest method allowed identification of more peptides and proteins than the SDS and PPS methods and there was no apparent bias for the type of peptides and proteins identified by the RapiGest and SDS methods, while a slightly higher proportion of hydrophilic peptides and proteins were identified by the PPS method. The performance of the SDS and PPS methods is similar in terms of the numbers of peptides and proteins identified. Since the SDS method required the removal of SDS using a technique such as strong-cation exchange (SCX), we further investigated the effect of SCX on sample loss through analyzing the digest of an enriched E. coli membrane fraction as well as a standard protein, bovine serum albumin (BSA). The results showed that extensive sample loss (as much as 62%) was encountered during the SCX cleaning step. We then applied the RapiGest method in combination with two-dimensional LC MS/MS to characterize the E. coli membrane proteome. In total, 1626 unique proteins (5799 unique peptides) were identified with a peptide false discovery rate of 2.4%. About 60% of the identified proteins with known cellular locations were found to be membrane proteins. Among them, about 75% were integral membrane proteins. This work represents one of the most comprehensive profiles of E. coli membrane proteome generated by a proteomic technique.",2011,Chemistry; Medicine,"list(name = ""F. P. Wu"", ids = ""48093057""); list(name = ""Difei Sun"", ids = ""6629251""); list(name = ""Nan Wang"", ids = ""92179621""); list(name = ""Yan Gong"", ids = ""145592507""); list(name = ""Lanjuan Li"", ids = ""50703439"")",669a25cf66f4dcc764edead6263027c96b11db57; a8cd29bfc5b7e2f3f064fa53f38c25539664a179; 4fbee75145ec0957ad5066dd51212897a6e2e1b3; 748f6bef7474721dedaab551d25fdaa16263239b; 4d06e966dd1286476b664ea803c9c1de88260b2e; 626d23a5f34df29cfa3338adaebcf8797911266d; 92256d387eefec0544096f076790768ca24a870b; 30405fb189bd1662bce9f5475762e0f52dc169bf; b6eee8224bb66bd22eca223a4854f2322369b099; 22f601ed8dde4a4bf4799536d10abe390797a1e4; 364c7ed08d4a9c15f17715dfd2e21a7113f14439; a3347ba2c9e2fb86eef883ab304f682a3b7aceb5; 783e87846334c9658593a28253d3f288668fba5b; f81effe7e85bd5fb5c47ed1579c812b14aae719b; cb7b7642f38524c1a73590ec14dfe53785be0e9b; 7a361aa0b1f7d482dcda06995ebbcf540b48c603; aaa46f00eb705457fba9f61a753ed8920c4bf1b3; d5094bd01f63cd54b6d58849841d7d4bb9bcf7bb; 2704ec5074a5a71323f2abf15df9de9a307bc3af,,Analytica chimica acta,698 1-2,"
          36-43
        "
e07ef11edf4b9a7e042444f3f98f0d04ee797626,Comprehensive molecular biomarker identification in breast cancer brain metastases,"BackgroundBreast cancer brain metastases (BCBM) develop in about 20â€“30% of breast cancer (BC) patients. BCBM are associated with dismal prognosis not at least due to lack of valuable molecular therapeutic targets. The aim of the study was to identify new molecular biomarkers and targets in BCBM by using complementary state-of-the-art techniques.MethodsWe compared array expression profiles of three BCBM with 16 non-brain metastatic BC and 16 primary brain tumors (prBT) using a false discovery rate (FDR) pÂ <Â 0.05 and fold change (FC)Â >Â 2. Biofunctional analysis was conducted on the differentially expressed probe sets. High-density arrays were employed to detect copy number variations (CNVs) and whole exome sequencing (WES) with paired-end reads of 150Â bp was utilized to detect gene mutations in the three BCBM.ResultsThe top 370 probe sets that were differentially expressed between BCBM and both BC and prBT were in the majority comparably overexpressed in BCBM and included, e.g. the coding genes BCL3, BNIP3, BNIP3P1, BRIP1, CASP14, CDC25A, DMBT1, IDH2, E2F1, MYCN, RAD51, RAD54L, and VDR. A number of small nucleolar RNAs (snoRNAs) were comparably overexpressed in BCBM and included SNORA1, SNORA2A, SNORA9, SNORA10, SNORA22, SNORA24, SNORA30, SNORA37, SNORA38, SNORA52, SNORA71A, SNORA71B, SNORA71C, SNORD13P2, SNORD15A, SNORD34, SNORD35A, SNORD41, SNORD53, and SCARNA22. The top canonical pathway was entitled, role of BRCA1 in DNA damage response. Network analysis revealed key nodes as Akt, ERK1/2, NFkB, and Ras in a predicted activation stage. Downregulated genes in a data set that was shared between BCBM and prBT comprised, e.g. BC cell line invasion markers JUN, MMP3, TFF1, and HAS2. Important cancer genes affected by CNVs included TP53, BRCA1, BRCA2, ERBB2, IDH1, and IDH2. WES detected numerous mutations, some of which affecting BC associated genes as CDH1, HEPACAM, and LOXHD1.ConclusionsUsing complementary molecular genetic techniques, this study identified shared and unshared molecular events in three highly aberrant BCBM emphasizing the challenge to detect new molecular biomarkers and targets with translational implications. Among new findings with the capacity to gain clinical relevance is the detection of overexpressed snoRNAs known to regulate some critical cellular functions as ribosome biogenesis.",2017,Medicine,"list(name = ""Hans-Juergen Schulten"", ids = ""6162809""); list(name = ""Mohammed Hasan Bangash"", ids = ""5565272""); list(name = ""Sajjad Karim"", ids = ""39221272""); list(name = ""Ashraf Dallol"", ids = ""5041664""); list(name = ""Deema Hussein"", ids = ""48860118""); list(name = ""Adnan A. Merdad"", ids = ""3546170""); list(name = ""Fatma Khinaifis Al-thoubaity"", ids = ""16285622""); list(name = ""Jaudah Al-Maghrabi"", ids = ""1382521379""); list(name = ""Awatif A. Jamal"", ids = ""4493576""); list(name = ""Fahad Alghamdi"", ids = ""3449361""); list(name = ""Hani Choudhry"", ids = ""4786834""); list(name = ""Saleh S Baeesa"", ids = ""6489286""); list(name = ""Adeel Gulzar Ahmed Chaudhary"", ids = ""38360767""); list(name = ""Mohammed H. Alqahtani"", ids = ""1402588182"")",6b7a45d948f481d309743402268c3f7acfbd4ecd; ba89db40df59078ef675a9bc1834746e1a6a6476; d736dd03b91112feee563994e7d9ee7daa6f408b; 90dc74e40cfbddef7f3be55bb87b65a94d165d14; 7ad202cacd1b7b4f41c1fa26c2c6a17967fb7029; 7ab21101798305eaaab3df366bb33a963475f7bf; ea2c4e289b81eeb2dc2b139f9893ad3cce0ae3a5; c46a93859bde1c83ab72daeb60c8de9b6d874050; d96ed3422070146e93e6316fef4b8c5a5d7492aa; 158d874bb13a63415785069340531526b369475a; 92a6597d8a51fb5263d649091a1e5c3db741f92e; 54768d480b2f03f01560e1a657b077b8ded061dd,14aae1b911da0d985a697ff7f7672ad79f282edd; db6d8a2dc65831ecce9bfd7dd584e036e47c8132; 6cadf7e7106211c8b2127e65f5d9ab52d7765125; 7c206e0be58775863b044dffcf2740ef86a6b4f7; 24160156b2fe7085f875b98a2cf0d58dc483d4a2; 3538ca287ed573a1981988060c6a6f215f0e5872; 2af83fb4d5940582fae9eba3020074b6f9620400; 2feb94a15784f59c8c3685d50c79c6674b8f70ae; 388a4bd83094095d51e00d318ffcdc18011f816f; aa47287a7714c363bbe1e77f2c687c6ceb80c076; f5245399e81d0105459327a50f77cd5d9c90d0b3; 10e7fa7348628c3d0a1132dd42b51d45d05b7342; 77636c69ca49b306e7445a935abf3c5d669e9908; b6de563c03eedf95d7e880a2aeb5688936ea1d26; 59027e293e130e74861b56f91139d1a94b6df489; 485831e536b5999535c696049b79e692a629e6b9; bfbfab7795844568ed05f5be3c5eb7e14150ef32; db42a19ad094951d8cb0d9d85ca5c471c320e013; ca38a14d4d9fb798ac18a36e8ca41649d4e8476d; e6e81a1fd1e3dfc2db26c83c2d02448a640b7dc2; 578a7fc0c15d7217b230bab9c8469e435388a543; c5d1388e09a23d632e0115e872f4121a80e488fe; 2bfe2fcdee94369aa68f16671922328fa3509c08; c1c1120c646acb86d1ba928867a6369ad40b38d7; 2f72c3f138a80a0a28b7da30389f249f69a86dfe; 4eb119ec443e86201c97e5b85684940f5530712d; d968d22124332992af934c565d18adb9f2f2c4cf; b0edb47fc17bf508595a5675f366c5dc45448686; 6e753a07e237028b6e66b228f65d972870038b28; 65a7c5603370ae6b46fc9fea6e6a291e679bec9a; ee51d1a5d639698a9654f8efab3b4dc0ac47d3f2; d3ae1946c00c5f52cbf2dc97940524f5376ca0a4; 40042d056ac0ac342281d5ccc3eb96dc04378e0c; 0e6485bf674f7af6e7ce7721dac6a1efdd94a0ca; 39ae296939e9e17a1098b83308819ce188d58abd; f2c3db8858998da191a6172fe79c114ac845a008; 4a0eff4380bc3c1dd23e3b1275af593424d6d48f; 33150d7d001f163a4c69c472a621fc5baa977789; 76955bbb6dd122783336c09e2ac5050a728f8217; b416dfd4f27e63da091695c1e539bfeee3b10e9e; 66502da45a55edf6fdc20cfac0fc5d7a264cde1b; 987f9399711d8ded6bfd4b02be61ea9f94711416; 11f647b95a7c9a94c346cd8dc53987105cb0f7c1; a07afffa37c3362a1a7c897f09ac954aa13a989e; 7c8b502c68ba598e738ab13d723750d45f862737; 1fca81438181200875c8cc659dbfb3c57acd03b0; 8130d4112d24f764fdb7c0494c53a8d8bd27c046; ca0a957bba7b9de1ced93f93a668df4f50f4af94; 5216bdeda360c47b54550af524e692d822b4fa45; d2b3c1f68f43e10080525f396fc660211a361bdd; 4f501b834b81c063624222fc217de1ff3d060f36; cc650f98e04ce6392c69022664de1f19418b73e4; 33946da2cb5237bb22d35f14a9ab8eb5f69bf99d; b4945f38fdff02f3e82aa7c2a8c33bad061bba49; 32d8a02e5b8a3b8e0badc25c5a7e0ca1d85e9552; f252fa09d8553371e8f83525f4895d87684b3606; 90a34320808fab55c897c43ecb56ad745f5b4e9f; 7fcb1a14b35beef7b8a5904cc23f19a162a601ec; 9b5f10024675930d5d237ff8614f387cb92eec86; 21e131b59e4000ad741f23df45e107a641fd7af2; 83dbaf733f2f44e9b4cee25bf625674bfadf1069; 305b5649a9215f05005711853568578b1e4b8326; 7c4d7db0bec1a2842485476f9fb16b469a3eadf1; d0d434366170f18f0745507af4b312edd0254cca; c8b2b550efbc179e437080e35e185e140cefce47; 3b5eec57b0987359dbf7a33498af2846dabe2fd9; 32abb40036c880a98396274a533c17c397933600; 1808cdb45986ed94966315bf25bc850a64df2e72; ba73219fa97c9458d5100f639e9a44ebaeb1db3e; c9eaeb141206f498ba8e86c65dda4440f1147ea4; 4e1b7d068602dd91335d07510c220f066ed82984; 6ce2d31b02de49ba8d918a4a22504818c30b10b9; 70c8840e2ebd35e135714226fc32bc40a216621d; 91683ff66dac6fa5664b14e4fbb59e23a93ff304; d2798c07c28a89bb4ab6486bb77fb8d39e79fe49; e9db152bb768ba947d735a9da04f338a51cb3cd9; 687ed1024bd5bb16606919ffed538407dbbffd45; 452f4743df4ea633ee862f413fa311333c983bf3; 95a3354793e7e7db2f00204b621bc85adb9d7015; 4fab3a273af553b17bb099baa0eca3ce6e67f42b; 2a24eaae54650a7f2d36069c6ea44c2e90f809ad; 6e95990c09156823e32535b8a2c983230db63eb2; 08348469d9c3553c2df81fb44e8a26cf74b7f14c; 0b9bc0f599736697ef7b24f94a3fe45fcfc916c3; 670fe78787866efe72ee5e4c7a901d969666e6c1; 909bb39ed50887cd439356d1592721800fa25680; 21136e53d8c16b444a2f3ec5a9a2b8ea0721e679; aa9a583547c7d6dde0c32f66b35f93867aad7d8c; cc3fb64140472f4b324a3cf48dabda5660ed106f,Journal of Translational Medicine,15,
