id,title,abstract,year,field,author,inCitation,outCitation,journalName,journalVolume,journalPages
a041c8d41ffaf6d9f91b09822fe16f878420da26,Multiple testing on standardized mortality ratios: a Bayesian hierarchical model for FDR estimation.,"The analysis of large data sets of standardized mortality ratios (SMRs), obtained by collecting observed and expected disease counts in a map of contiguous regions, is a first step in descriptive epidemiology to detect potential environmental risk factors. A common situation arises when counts are collected in small areas, that is, where the expected count is very low, and disease risks underlying the map are spatially correlated. Traditional p-value-based methods, which control the false discovery rate (FDR) by means of Poisson p-values, might achieve small sensitivity in identifying risk in small areas. This problem is the focus of the present work, where a Bayesian approach which performs a test to evaluate the null hypothesis of no risk over each SMR and controls the posterior FDR is proposed. A Bayesian hierarchical model including spatial random effects to allow for extra-Poisson variability is implemented providing estimates of the posterior probabilities that the null hypothesis of absence of risk is true. By means of such posterior probabilities, an estimate of the posterior FDR conditional on the data can be computed. A conservative estimation is needed to achieve the control which is checked by simulation. The availability of this estimate allows the practitioner to determine nonarbitrary FDR-based selection rules to identify high-risk areas according to a preset FDR level. Sensitivity and specificity of FDR-based rules are studied via simulation and a comparison with p-value-based rules is also shown. A real data set is analyzed using rules based on several FDR levels.",2011,Medicine; Mathematics,"list(name = ""Massimo Ventrucci"", ids = ""15791008""); list(name = ""E. Marian Scott"", ids = ""143791416""); list(name = ""Daniela Cocchi"", ids = ""34628687"")",f1ec243d167d1ca69b4112fe70523a047a9038c2; 2e61ea4f8c4797931e3a749dc5b2080221cf6a19; 6ba13c951fdc3cc472a8ceeba02142299236f1f4; 010f706dfae9d04b8c792adbe52e38db28801a94; a7ccce42518e93da967ca788ab09eb9a94684453; 919a531bf995f427dd540a8f65d0ad667ba11e79; 0be651670e303b6254511351eec4ed428d576ffe; 6c83e2d29d1618e65089aac26825d565816f54ac; 2d57d9ab72dee8bb2ed30cdf6559b559f9bc91af; 60809f56f5cd1c838f94385586eb04f97cc7fca5; cf6d6de60e0a94f6d4acef37ea4c751689d72cbd; b180c50ee294d2148e187148c472141d53fbd947; 1a96cd1895499f313908531cbcc8590b4d238149; 936ad0c88603fe8aa885facf6e9b62dea87a28df; cb1803aa49265eb6572ee63e499d0d119c57f734; ab0894f700577adc723ac2eb10315bbd73f35394; f710cfd2a703947e354dc92a4f82be793f9e3ab0,9f13bcb1b644ee861e02c1046c04c197ad809f3f; 6e4ef9da13090e66d28019b64a886041cb0428e5; df402aea66043c2ebc68293183e09f6e60a92626; 21b6c1b4a61d4d2ecbcdccea88b1e290648c08cf; 3599ecc225de0bbb4a34ac01d780681881639385; 66be81f765a825940748f6eb54b63a64ff972e7b; e2785711ea9c36b38b343e3e95a56cb32d21dbf9; b719662405c578178d82971e97ab852ff3e1db74; 076e50a5f963afcc2d45e3851e892e065b6735ba; 3506f8c4d8b6efaea1a6924374be0e6c9b1a28cb; b3f0a539fd43663f60c28fd0a1afdb95397399c4; fcef2258a963f3d3984a486185ddc4349c43aa35; f5def76fcebb36c826e17e6f68a5b875c356451b; f94defcf16bf4a8e779f9ae7b5ad870c8da34c4a; 1ed5fe7891d9ae6de014440ff046d6d7285ea367; bd53ebf7e28d0ee4d6904be1875c5a931d5b28bf; 821c6660965ab4925d49aebffb40fd831b23a3f6; 977a61f5b31aef34499caae9da079d79dc1d13a2; 7cae14836295b4dc43bbc66e7295658d9d4932d4; 3f4f7452103ae1bd273bcdf6c8ac990a2cf29645,Biostatistics,12 1,"
          51-67
        "
f6ed6b433e2a2628b0aca3256d7b2bb4165e3b2b,In-Depth Transcriptome Sequencing of Mexican Lime Trees Infected with Candidatus Phytoplasma aurantifolia,"Witches' broom disease of acid lime greatly affects the production of Mexican lime in Iran. It is caused by a phytoplasma (Candidatus Phytoplasma aurantifolia). However, the molecular mechanisms that underlie phytoplasma pathogenicity and the mode of interactions with host plants are largely unknown. Here, high-throughput transcriptome sequencing was conducted to explore gene expression signatures associated with phytoplasma infection in Mexican lime trees. We assembled 78,185 unique transcript sequences (unigenes) with an average length of 530 nt. Of these, 41,805 (53.4%) were annotated against the NCBI non-redundant (nr) protein database using a BLASTx search (e-value â‰¤ 1e-5). When the abundances of unigenes in healthy and infected plants were compared, 2,805 transcripts showed significant differences (false discovery rate â‰¤ 0.001 and log2 ratio â‰¥ 1.5). These differentially expressed genes (DEGs) were significantly enriched in 43 KEGG metabolic and regulatory pathways. The up-regulated DEGs were mainly categorized into pathways with possible implication in plant-pathogen interaction, including cell wall biogenesis and degradation, sucrose metabolism, secondary metabolism, hormone biosynthesis and signalling, amino acid and lipid metabolism, while down-regulated DEGs were predominantly enriched in ubiquitin proteolysis and oxidative phosphorylation pathways. Our analysis provides novel insight into the molecular pathways that are deregulated during the host-pathogen interaction in Mexican lime trees infected by phytoplasma. The findings can be valuable for unravelling the molecular mechanisms of plant-phytoplasma interactions and can pave the way for engineering lime trees with resistance to witches' broom disease.",2015,Biology; Medicine,"list(name = ""Mohsen Mardi"", ids = ""50427057""); list(name = ""Laleh Karimi Farsad"", ids = ""5083255""); list(name = ""Javad Gharechahi"", ids = ""4301319""); list(name = ""Ghasem Hosseini Salekdeh"", ids = ""4389040"")",a4605af561f3c5fa4dee537c0e40ffbe092dc8b5; 9805ef707f43067ddc14fd3339cf7bd5b6b8fe09; 4db47d8af9cdbf24b1eb1eb79540e8a68e9f70fe; 7afd6e341e2d637f5f1f9001b553f73d547fd2ba; 9a6b60e2eb1a8a7cd1d97e8065d40ef6b292b155; 0c543d9d2074f7ace6d05416a0639629fdbfbf76; 14381fe768c71b346648ddcda4d223813eed4c7b; c2e2db1e22b81f11646af6190c47bf6a155621e5; 50adc14e71d47cdccaee3f951d2104827bece33a; f6a1f21963483095a5db31c2542776149c0f80d6; 666fb904924b2387d67ffde82d4a247eb81619cb; 232b726953a70d3ec0fb5215049bec5f376a70bf; 27139caddf539c231a4fc061f7d280668e6bc2ae; 1bec92128d03c42c7354e234d97a056e8303ba4b,1f84e9d8af73a60c539ff4dca3a8ca471d7c69ac; a0436fc2001f681e465c87b478f35798fe56c4fe; 5da60059c776b5f236da410ab7427aa96d2f4f80; c24fb839af61e274548b85f21a03539f3dfda58b; 32e48251d870f4c8cb9ae33fee9c8804f2a27b7f; 4d277d672fe8b72bae67c27c1cce117539b5f66e; ad394b40743f515b48cab11a6da30bf66961b9a8; 15d63d21db8364fd35fdba15e99839ad54c49db8; bc103d96366ec97e0dd620894bbb04c8849eb772; 521fda4d279906ce4230feb38980e5095fa14ad0; a8beaa15ac328148db9dce2dfd9af36c226d7682; 091f9927c272e69f2604e75d07dd85da34557554; 0e1659a2b753141160f11ac37e286ddb0d36306d; 55f5e4f69932899c01dced2e53c311a444d81431; 0254f44107d5183282105af49a4a08b1182aa7ad; a840036022228b834c19c7e23cae8f1a1e37f28a; bb1ac724c591a46d1325adc3707d6c0e560e7113; b259267ea14d048e7bd713e6b8b949571a200e77; c94921341d98f1f49c9ca5200ae6143bd8ee6614; 9b7ac99e9e6c946cc39822c39cdaa2b8e96fdd0b; b1ccda4e876d03e370b27057b9ac031d90dd3266; f1186fd8a075ae7cdc71a9604de9e415d12d0b4a; ec27a1f0b5655736eaa7ef20cef274a75fa8ba14; 5b9e0b1c109c6d6a663cbeb8f358c20606e1734d; cf52a1395bf1f0c4dd829d3dda8f228bd4a27cb9; c45af62abe8e18a896834ec23acf83355e9378b3; ffe1c622ada0445238e770c20630b2cab60b51a4; eca7cd8ee8a9ee4de94d0ed3eade27f500a17fb1; 3299695c609ddfe1adf440cf6efc68b6e3b3243c; 7a2ba65cdb38acc77413dda2e2a1b968ffb08731; c6e319a023f932d6d2ff8897c2c91e56e872db8e; 96853b8bf7e36c5dd5338e2be50acacf521ea255; 7a98ea0d1de1badfe39dae4aa9c472bed716afba; e6c0ed9a2c3f786d8e1164849245794b38fbc50e; 5f152fa68cebfbcd908ed3b11a3921a4e8ad0975; d7ff71d4333d4938f7adc827d152f491f57e1374; 241d608844fd05a08c06ccaacda676a5fff8bdd1; 70a7b685a88d9f66256679cf0ed6d05a2d9f4c41; eff5a378c79354b087b13c9c73e8be529895e162; 941934f1c143ed2c653b372a25d2aa82ebb08787; d89c03560df2b861e48e38579b29bceea3fcdb39; f495e2121f80daa23377af2d80d69eefb03eee5e; 8aa77b42f5a83737acde7c3f51320ae2641b099a; 13ceda93a3f46544d59fad1c22c6e07c03bf515a; 71cd9f2ce7072705df33637c3f8673141c341527; 813c8088c6d37baeb37c4f83ecc1367f53fcfb61; a2f30c42940b61cf02b2ee758ecaa2da3a4685c1; 5252689d015e7882db7ff4eb10d71e79ec2bb0b3; 9d701478a8d06e567a1558caa74328257ef81186; 3b5972e205178769d57a66e59eb992f1aaea417d; e4c2d1f7614004702f3c8fe7e6b9f76c10571186; f4c4902636de6a0ec4aea3ee7ec939e59cd775dd; f3efe6247b6eef8ed4bb7474aa39d349ea24e4bf; dde498b3e2c67ccff047a7c1fc777e795562e393; e440b377027544c9b7161f5c3cafb53ab4c25af4; fb27a1e2da80ac40e93e8bee4e7ffd523c8b01a6; 1a3555826ef68df33933414fb8a0724ad715e97d; 9b02b233c939b5674b89be16533a555f5471c95d; f526714704214ab5e8bd087006e6c565409ce133; 28bfe8350e11a0e9c0f0405080a28991852087e4; ef117c95b92b68b751143155022a5c1a600afe5c; 6f570033c1d07467276ad185bf1521cd736c5f3f; f044e2c9d9f8cded382b94eae0a8f4829a64834a; f999428a85630e8b28eba424ccd9a4272db38e87; 00f3bc0c8f327ab497cb3584e5a27f101b82cd16; 8c2845479691e9789f3c70935dc082fb3c08f584; 48727c4043e627480041983c8614fdfa1bd4c02d; 9229513cf06cba98033da8be2a5956b566a72524; 65eb4eddb3861c11de962793af7b77eb5136979a; ad46db217d1360d9b3da8f04e9ec3b263dc5d39e; e1564afb8e0cf7a421ae3f33a802746ad85c25ad; 989500e685dcdfcf7fbe95895f5efc985edb914b; d709a1289d606c051cb31130768a51a4f13dff1c; f122f5f998de1e22dc791f204b247c05b11ebb2d; 43a68df207116bc7eb373f06c155f9af432020a3; 3040ac52b3154de53a831715f2ce7f4e7d3d723b; 42d23c0f14c07123b3c3d9a9e3f51e5e94db8b65; 008936cb66dccf804becbd016c57e69e088c3aa2; 93801675d98cf8df39465bccbd5575303a97ff5d,PLoS ONE,10,
090b3d4b765dcbaf5265f6d371500ed2a5469ecc,Relations of brain volumes with cognitive function in males 45 years and older with past lead exposure,"We examined relations between brain volumes assessed by MRI and cognitive function in subjects in whom we have previously reported associations of cumulative lead dose with: (1) longitudinal declines in cognitive function; (2) smaller volumes of several regions of interest (ROIs) in the brain; and (3) increased prevalence and severity of white matter lesions. We used two complementary methods (ROI- [evaluating 20 ROIs] and voxel-wise) to examine associations between brain volumes and cognitive function using multiple linear regression. MRIs and cognitive testing were obtained from 532 former organolead workers with a mean (SD) age of 56.1 (7.7) years and a mean of 18.0 (11.0) years since the last occupational exposure to lead at the time of MRI acquisition. Cognitive testing was grouped into six domains of function (visuo-construction, verbal memory and learning, visual memory, executive functioning, eye-hand coordination, processing speed). Results indicated that larger ROI volumes were associated with better cognitive function in five of six cognitive domains, with significant associations observed for visuo-construction (15 of 20, p<or=0.05), processing speed (12, p<or=0.05), visual memory (11, p<or=0.05), executive functioning (11, p<or=0.05), and eye-hand coordination (11, p<or=0.05). Significant structure-function relations were also identified in the voxel-wise analysis with low false discovery rates (all less than 2.2%). Thus, larger volumes were associated with better cognitive function using both ROI- and voxel-based methods. In this cohort, an interesting group in which to examine structure-function relations, this finding provides a necessary condition to support the hypothesis that lead may influence cognitive function by its effect on brain volumes.",2007,Psychology; Computer Science; Medicine,"list(name = ""Brian S. Schwartz"", ids = ""2336097""); list(name = ""Sining Chen"", ids = ""50358152""); list(name = ""Brian Caffo"", ids = ""145165799""); list(name = ""Walter F. Stewart"", ids = ""143691397""); list(name = ""Karen I. Bolla"", ids = ""2912360""); list(name = ""David M. Yousem"", ids = ""3264983""); list(name = ""Christos Davatzikos"", ids = ""1740714"")",de59e6a72592a9094b1725d424509f3af606c36d; f51ba1cf26d3eda369195ac33f6967689b5dbab6; 06cb277334001fb68827452c0a4518c1a689da06; 4abb8b75a38b2f13661c06f8c3a541163f6b91fa; 536ae0f92061c60925c9dcf7fca41311df9caa66; ba1e749899ac56d7b6da642a55276d1a0cf6155c; e443bf469a68e3038089f23ea93c41f4d55107a1; 3842d501b08af142d47b165f215984c22d2d6f4e; 3a35284c36a601d0a06350b168adef40454fefd6; af3a519e16c79693cc7a6eb4bf2ca8826b36cafd; 5601a8a264d5a6332bd0acc561a45a4217c132ce; 549e19de36896424bee226732ffa5330059f10c6; 3fc30b93d9f006765bda2361eb1d089d838fc6cc; 8cf24ae2da843c6ff25f1b80bd42cad568513488; 647fdbeec2661e6e2ff796c0c6025e5435871aaf; d38a7a2b013d6a11c3dd1254dab76df71ab2a4ec; a0ff67a141eb4b0b9c118170300343f935ee9f43; 7f7ac42c3030a73ed8247b280c3220582919f1fd; bd63c803bf46f459cb898ea3d52e2d5eb46c9acc; b14a1e52cc59539c4134bb421ff23c3511b0cd94; 0be445aa7184f3fd10d0a5624b111e05408ed6e3; 87e979edcdcaaa6163adb69b097c7e336e1031d7; bc32eefff6b06300971fad0d054d62546c824d85; 6976278bef1c6988b3caaf718a37b8365cd9bdb5; c248dad7b57bfab661384d6a8ac82081d6d43bce; a17b21cebac28a06a7e72581a157f00b0c1858df; 8aede42cc11d661524cda55728ee6df942873a41,20644aadec8b77ed977741221cab825723250b86; b799de6eb0fe8fe74aca4335b6b05dff17b74006; 78754163cc44c41dbe0d0d0fb47e70dcaab70622; f2c1ddf5c34a5899c5cbee5b5dc469f39ff9c21e; 3298a41110fa54323660270c7169e6d1c2d9faef; 45607be0c11e776576c642c570c742b5a81db0fe; 50afbfaf70da25b142c75858f5567d75c110e7d6; 1d1937897b3e3f49b31cb3a51aee969139630a3d; 2f00268c2887cb0fd3b93569a161b074310b4a14; bc690f553f329b497307f309738c6671ce25e733; 5829a7ea7294463f4496d87ba1ceaff260edc53f; 597597286f9ab0aed05923e4111bd2d9312d2e02; a909607bc965989c14ca7eae53dc3c2ce353a336; f6dddac967e3347d0cb1b48fec50b5999102fe44; 726ebc7fec5167bd68d05a35de8acf749092398b; 8e3aef7d904e7c349beae386cd90574bdd3d78e5; 952e82035901ce278e2a8897ef829105225f1463; 3ce67f236d5425b351f1d377523a71027d36244d; 9787aaf2e1da52f5af1aa81da50f1376220b1046; 821c6660965ab4925d49aebffb40fd831b23a3f6; 1d3e0858890c7da0872ad1c2d9313f582d8960d8; 86b0b5ccfa4f1d7a1e900bac91cac4ae3a2cab62; 027cd7d8f11ea44725c32c394d918b54aa2ef498; 61100e06ab1522a15d67245ec811b3ef2f818c7a; ceb69c1b4861da4873d4e4653e422d346a7549e4; 872ba98aaf60cabed8c6881df83e07550b80126f; fc544c298307921edae322f1b4618c7cf5f027ce; 870defdb9bbb026cc9b04bfc08d280575b03833b; 464f58b1bc211b7aa83f4a10707f493080253b92; 50343f03a101807c1f4e9670f48c2746d970d091; de10b157afe569a2b63626517b29d653068e184d; 0657cfbd84c4f57bb7ffb1049f0c59f3567c0730; 66aee017ec627ffbc28f66cc45b58eb2be90215c; 49926d094312cf63c5754276dd3050749ca25382; 9cd7eeabfd10f1cfd30db38996d17bb3cd132c60; 0bdac7ad1734735924526cfc94e4a02599a8334e; fcef2258a963f3d3984a486185ddc4349c43aa35; ea1e238e582a88115f1bb8a58704884f2c3f1752,NeuroImage,37,633-641
d9e2a43715b103e66d940cb52c98248bbe7d7afb,Single-index modulated multiple testing,"In the context of large-scale multiple testing, hypotheses are often accompanied with certain prior information. In this paper, we present a single-index modulated (SIM) multiple testing procedure, which maintains control of the false discovery rate while incorporating prior information, by assuming the availability of a bivariate $p$-value, $(p_1,p_2)$, for each hypothesis, where $p_1$ is a preliminary $p$-value from prior information and $p_2$ is the primary $p$-value for the ultimate analysis. To find the optimal rejection region for the bivariate $p$-value, we propose a criteria based on the ratio of probability density functions of $(p_1,p_2)$ under the true null and nonnull. This criteria in the bivariate normal setting further motivates us to project the bivariate $p$-value to a single-index, $p(\theta)$, for a wide range of directions $\theta$. The true null distribution of $p(\theta)$ is estimated via parametric and nonparametric approaches, leading to two procedures for estimating and controlling the false discovery rate. To derive the optimal projection direction $\theta$, we propose a new approach based on power comparison, which is further shown to be consistent under some mild conditions. Simulation evaluations indicate that the SIM multiple testing procedure improves the detection power significantly while controlling the false discovery rate. Analysis of a real dataset will be illustrated.",2014,Mathematics,"list(name = ""Lilun Du"", ids = ""51417074""); list(name = ""Chunming Zhang"", ids = ""50445608"")",24b9bbf8a420f1013d7d08e49a17f6e116b8f06e; 2e5258900ba2f9134dcd5bee4a1f88091a972234; 1ee765d218aaea7ef4d95df27043954fb7d3b4df; 1cde092ab27bf3359036add31f172bc3c31f7093; 1e18ad1d5a5311cfc801755fbf5a2c302116ffa1; 6de25f28f84c031d066466e04576b7038b85a403; b680bc211550d283bc2800eb9db32353364e19dc; 9c878593318d379b8d890abdb4550dd78bfa27e2; 2158eaf6bf6293d5d14dd096f1f1363c5a0388fe; 84de2e040bd0536a0e0d0d28c2b4bca0879103bb; 98e53d3186bc5ee62e716254db3d18bfee8c2cb8; 7de19f9df35371e467b0f6c1bf7d054799864561,deaafb99a72e81af87f961662410f9bcefa37c0a; fcef2258a963f3d3984a486185ddc4349c43aa35; ce2605f83e604a55beafdc4bc003c5979c8d794a; a03e6e5b81637b34f9a9a446f0a3158a64befe96; b719662405c578178d82971e97ab852ff3e1db74; ced6437989fac5d9ac2700827fbcffe9cad379e0; 9620822ac80d788f8adc92c637e856c65faee589; d2edf7654e05615b5d769c5e969a4b9030605f1b; e9cddd8d7c37989539e6c6bad14db3d488441ea5; 8c1eed72bb4c630e18c051b062dfab77e12eddb6; 9fe2d0cda6d19d93cb31b1e1871131ef5d23aab1; 21b6c1b4a61d4d2ecbcdccea88b1e290648c08cf; 3adc5eefac9d7866078361a298d62af2674c9653; 5075cd2006b94c25766accc5594a9ecd55049382; 0cc325ee022c258b30da3247a60828f7adf4d14c; 5800894aa631837c684614c2e108da79f73af2a2; 57e7a7323f58a35f5e2cc33bf17d4ac9cdcafdd4; 840c0cdb1f428d300cd7986d170da5f807b3d20d; 42b8e76177e1501b122107999819cbee8b48f093; 2888f87e01c7adfd95f02c52339a7db8ad329677; bca451df3cdfd544611cf6186e99ca991c61712b; 0de37850eb3e83270a3eedd59647f4f387f39049; c4facda9a91fea8fa08f6e4559d585605622d905; 7d3af458d51818254adc6c7e3383634fe0d8591d; 2c4c300672ea8634f4714432cbd54d9f3f9d37b4; 19db626d6dad8bc0916b88e2629fb5131a30ee0b; b877cf63a1174fbafc1a91aa009f6e9b9c661849; 14dbb89b8412388b0e0331fc2c696891e6a5d1e6; 467966480503191520274a4b865ed23ba0594977; e20b15ba1a0d141e5e814ca2667031c61dae5484; 821c6660965ab4925d49aebffb40fd831b23a3f6; 4a579e646bdf703cc78c8f4c48ab629f383c7074; 4225126bdc2a75577fa6f9ea67d0b4617773c44b; 7772a2c4227577c244009f25e950c1d1f2504060; 04dce5a4a145f1898f8bce2a648035e93fae3191,Annals of Statistics,42,1262-1311
456c5473e98f412c7de6d7d911582d6e50933613,Allelic heterogeneity and more detailed analyses of known loci explain additional phenotypic variation and reveal complex patterns of association,"The identification of multiple signals at individual loci could explain additional phenotypic variance ('missing heritability') of common traits, and help identify causal genes. We examined gene expression levels as a model trait because of the large number of strong genetic effects acting in cis. Using expression profiles from 613 individuals, we performed genome-wide single nucleotide polymorphism (SNP) analyses to identify cis-expression quantitative trait loci (eQTLs), and conditional analysis to identify second signals. We examined patterns of association when accounting for multiple SNPs at a locus and when including additional SNPs from the 1000 Genomes Project. We identified 1298 cis-eQTLs at an approximate false discovery rate 0.01, of which 118 (9%) showed evidence of a second independent signal. For this subset of 118 traits, accounting for two signals resulted in an average 31% increase in phenotypic variance explained (Wilcoxon P< 0.0001). The association of SNPs with cis gene expression could increase, stay similar or decrease in significance when accounting for linkage disequilibrium with second signals at the same locus. Pairs of SNPs increasing in significance tended to have gene expression increasing alleles on opposite haplotypes, whereas pairs of SNPs decreasing in significance tended to have gene expression increasing alleles on the same haplotypes. Adding data from the 1000 Genomes Project showed that apparently independent signals could be potentially explained by a single association signal. Our results show that accounting for multiple variants at a locus will increase the variance explained in a substantial fraction of loci, but that allelic heterogeneity will be difficult to define without resequencing loci and functional work.",2011,Biology; Medicine,"list(name = ""Andrew R Wood"", ids = ""8493079""); list(name = ""Dena G Hernandez"", ids = ""145562703""); list(name = ""Michael A. Nalls"", ids = ""5521775""); list(name = ""Hanieh Yaghootkar"", ids = ""6273933""); list(name = ""Jesse Raphael Gibbs"", ids = ""1811094""); list(name = ""Lorna W. Harries"", ids = ""143825990""); list(name = ""Sean B. Chong"", ids = ""116720314""); list(name = ""Matthew A. Moore"", ids = ""145512923""); list(name = ""M. N. Weedon"", ids = ""144076919""); list(name = ""Jack M. Guralnik"", ids = ""145769260""); list(name = ""Stefania Bandinelli"", ids = ""7364307""); list(name = ""Anna Murray"", ids = ""1896300""); list(name = ""Luigi Ferrucci"", ids = ""1737506""); list(name = ""Andrew B. Singleton"", ids = ""144913243""); list(name = ""David Melzer"", ids = ""6578742""); list(name = ""Timothy M. Frayling"", ids = ""2693276"")",36faf092724d8dc8e698da2102a0a10657dde4e3; bfe91985cad06ceafae56fca2612ba98d2e22d3a; 524613c40ac411ed5a7d57190181dee3838e0869; 4b0ef84cad2af793db2d04b636a5cedccdcdec7c; 6f6e364409b9f525e6f1bf7b53730258c467966a; 2909940517692e12066ffaa1f318b23442c8b50b; 832318f53d9f0ed7276b022cdb97da65508ef666; 84662bf12d29bfc4f4d44cf1fbc3b1f4912fd1ec; 154ec88a59415ef686153c755c7cb4a8e4e0fd32; d0f1a33048700406b47c596d7ec8d4164c67845c; d52e08540de4f4eaa89d9c2f756dd77124a9c6de; 407f41d68ab99b7632b1ab799590d3586509d6d4; 60e78a8889f51c0c580f852b9b8a26091fcb42fe; 10a05a2dd24ffbd16adf84928cd98760c6233ab6; b54e3a916aae6398e1917e8744594e65c26b2a55; f09fe0351b3acf909e153c7039aaf25da5c93176; fe7b4e39ffe067929a3ed911cef5075ce4a865ae; a3039aa54d1e06f02f6c1edfedba5a39363b757c; e01b5d5e4b153f660d1241c7add9535478da1701; ac1332f19d0a82886bc74f5168abfb8c5c9e99dc; 830b77a775db5eebb4edb65ff6d56377522cbb3a; 3b3345d20b33e2b984b937c8faa3b8bec3f3f431; 21dcb699f209fe93ec80428096aca13aaeecc3be; 28ed5f5a3cb2280dadba11ba932f878a0f883b49; fb78c3834972331588d2990a1541d225c285370e; a27ef4d38e6fbe6cc3918f0e1ab5e608897e798c; 008f227a8090303813104585ef9c731d70597825; 977dda0f88203277c1c5d29d823b6dcf9c0d7910; 07cb0b973e7328ecb1ac6305f17694fc150a77b8; 68c95b822e809ea62ca1a0e2bc777ff517da1881; fa186d09e50932fe961f725a856c567d60bc1c81; 231255cc0e30d2e237c1f9cc4bf89145a3bafad5; b747361e85894608dbe32b0fd19b599a37059780; 7d31e912e7e31594395770186b28f442ac38058e; f6fbafc159d6f96e31dbd04572d016676d011bca; 7e6c41dd4d312c832408defbfe4ca9c36d46c546; 9b793988d1576f6eb626b9f37f4760726b99af00; 5b07e5ab2f0f0557c1664d6a7825cceba3f15b7a; 9dc0d4dd69612635081d0c132b0735014f7c0085; 3fcadb3098b24af19667d3c0d1bdeee8218948e2; 4a9a1dd0782029cdd4028ba8f9b17f8e7e4bf0ed; 2c7ebaa9b933493754cc613550a1d7f6e1579328; 900ed7c37d9eff728156db2550add74f5908167e; 2e9306072e8abe2bc4b9630517681bda5de3c762; 77fda8193d96f8b1b507333367aaeb97b564002b; 77858af95cb7ecaec84144330111b15bb25d0e37; 5f0298f99cadbbc1d9fc48fad11606edf57d7a5f; 2297578261065d552c299cf844cd109751a600cc; 6c8f803f736a11ca9b04cdca46651b8942d57cac; 38469867366be7610c786e56eb6f345eb3b91ec8; fd120c3e702299617b3f7a311bf9a2a24aa34073; 89e51c3111c2dc74dfd1bdf5bbd0efb45e3f5400; 53ba1ffe5f8740ef52c990919d09e8907ce8ee47; f0f48a7e3e3d4a0d9d98b10994c0e4dd338fc183,ac23370c30f7a532120fe08f87d81dc7a315e299; 456d1618a29f6ab257e914e4129768f5c593a81b; 992097351586babf85562c94c0e06fee115d4f05; 6c6e047cc3dd335aa781b9f22ffb4a8dbb5b2701; 078f024fec9f28950aa23740aa97d93397ec16b4; a1b0949d10942ea5968158aded3f4f3630717f8e; fe0ac0fcd054371e599473a4ab91308d43c4b59d; 1c1cb27c2512f7263c622865f534a66b630bc6de; 0d5d35d9992a30ac5db6e75b7cace703868938e3; 76ada33eae0abcb5512fe0fa37a5d67c639fce67; febeed04fa38393ad6a6072953f624e22b865458; 616f8d0771a6fd2b12de39dfb1ea96fb32fe4e57; 5903301093c7e31d5050404b29ccad8414fc0d29; a6f8491fe0fdbc2b8c18f4e2cd89611c85be9671; 9288d828fa29f9be5dd86f1b1705fab3c7abd473; 2c51236f3de94c7a99b82f09176e10063e981821; 76443c2a2b4c3f0f8d5624a5bd3044db747eb940; 9d7af049cf76892dc1b5126c5a51cd09e08e3b5d,Human Molecular Genetics,20,4082 - 4092
